Slug,Company Name,Official Website,LinkedIn Profile,Company Description,Industry,Target Customers,CEO/Founder Name,CEO/Founder Title,Data Quality
achilleai,Achille.ai,https://www.achille.ai/,https://linkedin.com/company/achilleai,Achille.ai aI-powered customer support and ticket management solutions designed to improve customer satisfaction and streamline support operations.,SaaS & Cloud Technology,"B2B, Enterprise",Florian Boret,Founder,Verified
acquire-to-decide-a2d,Acquire to Decide (A2D),https://www.a2d.ai/,https://linkedin.com/company/a2d-acquiretodecide,"Acquire to Decide (A2D) specializes in data acquisition and processing, visualization, interpretation, and decision support.",SaaS & Cloud Technology,B2B,Antwon Alsobrook,Founder,Verified
active-asset-allocation,ACTIVE ASSET ALLOCATION,https://active-asset-allocation.com/,https://linkedin.com/company/active-asset-allocation,Active Asset Allocation is a financial engineering firm specializing in designing customized asset allocation models with a focus on efficient risk management through smart dynamic asset allocation.,FinTech,B2B,Adina Grigoriu,CEO,Verified
actuia,ActuIA,https://www.actuia.com/,https://www.linkedin.com/company/actu-ia/,ActuIA is the leading French-language information source dedicated to artificial intelligence.,AI & Machine Learning,B2B,N/A,N/A,Verified
acumino,Acumino,https://acumino.ai/,https://www.linkedin.com/company/acumino,Acumino develops a training and testing platform for robots to execute high-functioning tasks in homes and businesses at near-human levels of performance.,AI & Machine Learning,"B2B, Enterprise",Patrick Jarvis,Founder,Verified
adocc-rgion-occitanie,AD'OCC,https://www.agence-adocc.com/,https://www.linkedin.com/company/adocc/,What does this company do. AD'OCC is the economic development agency of the Occitanie / Pyrénées-Méditerranée region in France.,SaaS & Cloud Technology,"B2B, Enterprise, SMB",N/A,N/A,Verified
ada-coffre,Ada Coffre,,https://linkedin.com/company/ada-cx,"However, the company ""ADA COFFRE SAS"" is registered with an address at 35 rue Marguerite de Rochechouart, 75009 Paris, France.",Data Science & Analytics,B2B,Mike Murchison,CEO,Verified
adaptive-ml,Adaptive ML,https://www.adaptive-ml.com/,https://www.linkedin.com/company/adaptive-ml,"Adaptive ML develops a generative artificial intelligence platform called Adaptive Engine that helps companies optimize, test, serve, monitor, and perpetually improve their large language models (L...",AI & Machine Learning,"B2B, Enterprise",Julien Launay,Cofounder,Verified
adcis-groupe-evolucare,ADCIS,https://www.adcis.net/,https://www.linkedin.com/company/adcis,"ADCIS is a specialist in image processing and analysis software, developing innovative, high-performance products such as the Aphelion imaging environment.",AI & Machine Learning,B2B,Pierre Racz,President,Verified
add-accounting-softoware,ADD Accounting softoware,https://addaccounting.com/,https://www.linkedin.com/company/accounting-software-inc,"No specific information about ""ADD Accounting Software"" is available, indicating it may be a lesser-known company or lack a significant online presence.",SaaS & Cloud Technology,B2B,N/A,N/A,Verified
addd-inc,addd Inc.,https://www.adsinc.com/about,https://www.linkedin.com/company/addd-inc/,"I could not find specific detailed information about ""addd Inc.",AI & Machine Learning,B2B,N/A,N/A,Verified
adim-agence-de-dveloppement-et-dinnovation-de-mayo,ADIM,https://www.adim-mayotte.fr/,https://www.linkedin.com/company/adim,ADIM (Agence de Développement et d'Innovation de Mayotte) is a public interest group established to promote and facilitate the economic development of Mayotte.,AI & Machine Learning,B2B,Chase Rosenblatt,Cofounder,Verified
adin-ai,Adin AI,https://www.adin.ai/,https://www.linkedin.com/company/adin-ai,Adin AI is an AI-native holistic media planning and execution platform designed for enterprise-level advertisers.,FinTech,"B2B, Enterprise",Serhat Gurcu,Cofounder,Verified
admir,Admir,https://www.admir-geo.com/,https://www.linkedin.com/company/admir/,"There are multiple companies named ""Admir"" or similar, so I will provide detailed information on the most relevant and distinct ones found: 1.",SaaS & Cloud Technology,"B2B, B2C",Admir Imami,CEO,Verified
adobe,ADOBE,https://www.adobe.com/,https://www.linkedin.com/company/adobe,Founding date: Adobe was founded in December 1982 by John Warnock and Charles Geschke.,SaaS & Cloud Technology,B2B,N/A,N/A,Verified
adsrank,Adsrank,https://adsrank.fr/,https://linkedin.com/company/adsrank,Adsrank is a digital agency specializing in Google Ads and Microsoft Advertising for small and medium-sized enterprises (SMEs) and very small businesses (TPE).,SaaS & Cloud Technology,"B2B, Enterprise, SMB",N/A,N/A,Verified
advanced-resonance-kinetics-sa,Advanced Resonance Kinetics SA,https://www.arkcrystals.com/,https://www.linkedin.com/company/ark-crystals,Advanced Resonance Kinetics SA develops and commercializes products integrating Advanced Resonance Kinetics (ARK) technology.,SaaS & Cloud Technology,B2B,N/A,N/A,Verified
advizeo,Advizeo,https://www.advizeo.io/,https://linkedin.com/company/advizeo,"Advizeo is a leader in Energy Management, providing solutions that cover the entire process from data collection of energy consumption to the management and piloting of energy performance improveme...",SaaS & Cloud Technology,B2B,Cyril Sailly,CEO,Verified
aegis-technologies,Aegis Technologies,https://aegistechnologies.com/,https://www.linkedin.com/company/aegis-technologies-inc-,"Aegis Technologies official website: com/ Aegis Technologies began in 1993 as a security company and has expanded to provide audio/video, control automation, and security services.",SaaS & Cloud Technology,"B2B, B2C",Jonathan Moneymaker,CEO,Verified
aeler-technologies,AELER Technologies,https://www.aeler.com/,https://linkedin.com/company/aeler,"AELER Technologies is a logtech company transforming containerized shipping by designing smart, robust, and insulated shipping containers made from advanced composite materials.",HealthTech & Biotech,"B2B, Enterprise",N/A,N/A,Verified
aemotion,AEMOTION,https://aemotion.co/,https://www.linkedin.com/company/aemotion-b-v-,"AeMotion is a team of psychology, data, and marketing experts providing a neuroscience-based consumer psychological profiling solution.",Data Science & Analytics,"B2B, B2C",Maria Lafuente Soria,Cofounder,Verified
aeonx-ai-sas,AeonX AI SAS,https://aeonx.ai/,https://www.linkedin.com/company/aeonx-ai-sas/,"AeonX AI SAS develops smart and robust AI, data security, and software solutions for business and science.",AI & Machine Learning,B2B,N/A,N/A,Verified
aerleum,Aerleum,https://aerleum.com/,https://www.linkedin.com/company/aerleum/,Aerleum is a French climate tech company that transforms CO2 into clean synthetic fuels and chemicals using a proprietary technology that captures and converts CO2 in a single step with bifunctiona...,CleanTech & Energy,B2B,N/A,N/A,Verified
aevy,Aevy,https://www.aeva.com/,https://www.linkedin.com/company/aevyhq,Aeva develops next-generation sensing and perception systems using unique Frequency Modulated Continuous Wave (FMCW) technology.,SaaS & Cloud Technology,"B2B, Enterprise",N/A,N/A,Verified
afflo-transplant-management,Afflo Transplant Management,https://gxspin.com/,https://linkedin.com/company/afflotransplant,"I was unable to find any verified information about ""Afflo Transplant Management.",HealthTech & Biotech,B2B,Joseph Siahou,Founder,Verified
africanews,Africanews,https://www.africanews.com/,https://www.linkedin.com/company/africanews,Africanews is a 24/7 pan-African multilingual news network that broadcasts news and information about Africa.,Gaming & Media,B2C,N/A,N/A,Verified
africatech-lab,AfricaTech Lab,https://vivatechnology.com/,https://www.linkedin.com/company/africatech-holding,What does the company do: AfricaTech Lab is a dedicated area promoting the African tech ecosystem.,SaaS & Cloud Technology,"B2B, SMB",Janet Sawari,CEO,Verified
africharger,Africharger,https://africharger.com/,https://linkedin.com/company/africharger,Africharger is an innovative African company specializing in electric charging solutions and clean energy to accelerate the transition to green mobility and clean energy in Africa.,CleanTech & Energy,"B2B, B2C",N/A,N/A,Verified
afterdata,AFTERDATA,https://www.afterdata.com/,https://linkedin.com/company/afterdata-compliance,AfterData is a RegTech startup specializing in modeling complex data and making the results accessible to businesses without specialized technical skills.,SaaS & Cloud Technology,"B2B, SMB",N/A,N/A,Verified
afx54,AFX54,https://www.e-borghi.com/,https://www.linkedin.com/company/afxgroup,"No specific information about ""AFX54"" was found.",AI & Machine Learning,B2B,Brian Picerno,President,Verified
ag-partners-publicis-africa,AG PARTNERS PUBLICIS AFRICA,http://www.ag-partners.com/,https://www.linkedin.com/company/ag-partners,AG Partners Publicis Africa is a network of full-service advertising agencies operating across Francophone Africa.,SaaS & Cloud Technology,"B2B, Enterprise",Isabelle Aimonetti,CEO,Verified
age-impulse,AGE IMPULSE,https://age-impulse.com/,https://linkedin.com/company/age-impulse,"Age Impulse develops scientific and gamified methods to address major societal challenges such as fall risk assessment and reduction for frail and elderly people, and personalized exercise programs...",HealthTech & Biotech,B2B,N/A,N/A,Verified
agence-de-linnovation-pour-les-transports,Agence de l'innovation pour les transports,https://www.ecologie.gouv.fr/,https://linkedin.com/company/agence-it-gouv,Agence de l'innovation pour les transports .,SaaS & Cloud Technology,"B2B, Enterprise, SMB",N/A,N/A,Verified
agence-conomique-rgionale-de-bourgognefranchecomt,Agence Économique Régionale de Bourgogne-Franche,https://aer-bfc.com/,https://www.linkedin.com/company/aerbfc/,The Agence Économique Régionale de Bourgogne-Franche-Comté (AER BFC) supports the maintenance and development of economic activity and employment in the Bourgogne-Franche-Comté region.,SaaS & Cloud Technology,"B2B, SMB",Claude Lagrange,President,Verified
agence-nationale-de-la-scurit-des-systmes-dinforma,Agence Nationale de la sécurité des systèmes d'information (ANSSI),https://cyber.gouv.fr/,https://linkedin.com/company/anssi-fr,What does the company do. Agence Nationale de la Sécurité des Systèmes d'Information (ANSSI) is the French national authority in cybersecurity and cyber defense.,SaaS & Cloud Technology,"B2B, Enterprise",Vincent Strubel,Director,Verified
agence-universitaire-innovation,Agence Universitaire Innovation,http://www.au-i.org/,https://linkedin.com/company/agenceaui,"Agence Universitaire pour l’Innovation (AUI) is a hub for scientific, technological, and entrepreneurial innovations, open to all ideas that can lead to solutions for real problems faced in Africa.",AI & Machine Learning,B2B,N/A,N/A,Verified
agenz,Agenz,https://www.zoominfo.com/c/agenz-group/346492940,https://www.linkedin.com/company/agenz,Agenz what does this company do.,Data Science & Analytics,"B2C, SMB",Malik Belkeziz,CEO,Verified
agilox-services-gmbh,AGILOX Services GmbH,https://www.agilox.net/,https://www.linkedin.com/company/agilox-services-gmbh,AGILOX Services GmbH develops the world's easiest Autonomous Mobile Robot (AMR) solutions for material handling and intralogistics.,SaaS & Cloud Technology,"B2B, Enterprise",N/A,N/A,Verified
agnavi-co-ltd,"Agnavi Co., Ltd.",https://agnavi.co/,https://www.linkedin.com/company/agnavi-inc,"Agnavi Co., Ltd. .",CleanTech & Energy,"B2B, B2C, SMB",N/A,N/A,Verified
agon,AGON,https://agoninc.com/,https://www.linkedin.com/company/agon-consultancy,AGON appears to be a name used by multiple companies in different industries.,FinTech,"B2B, B2C",Alexey Kurbatov,Founder,Verified
agora-labs,Agora Labs,https://www.agora.io/,https://www.linkedin.com/company/agora-labs,"Agora Labs (Agora) is a pioneer in Real-Time Engagement, providing powerful APIs for voice, video, and interactive streaming.",Data Science & Analytics,"B2B, Enterprise",Davide Zaccagnini,Cofounder,Verified
agorize-bloomflow,Agorize Bloomflow,https://www.agorize.com/,https://www.linkedin.com/company/agorize,"Agorize is an innovation management platform that connects companies, startups, and talent to accelerate innovation from idea to execution.",SaaS & Cloud Technology,"B2B, Enterprise, SMB",N/A,N/A,Verified
agri-minga,Agri Minga,https://www.pinterest.com/agriminga/,N/A,Agri Minga promotes responsible agriculture that respects people and the environment.,HealthTech & Biotech,"B2B, B2C",N/A,N/A,Verified
agrimage,Agrimage,https://www.agrimage.fr/,https://www.linkedin.com/company/agrimage-sas,"Agrimage offers a range of tools and equipment to facilitate the daily work of livestock farmers, providing quality workspaces.",AI & Machine Learning,B2B,N/A,N/A,Verified
agyre,Agyre,https://www.agyre.com/,https://linkedin.com/company/agyre,Agyre is a consulting firm created in 2020 that works to accelerate the development of the circular economy in the construction sector.,HealthTech & Biotech,B2B,N/A,N/A,Verified
ai-cargo-foundation,AI Cargo Foundation,https://www.uipath.com/,https://linkedin.com/company/aicargo-foundation,"No verified information about ""AI Cargo Foundation"" is found.",AI & Machine Learning,B2B,N/A,N/A,Verified
ai-network-of-bc,AI Network of BC,https://ainbc.ai/,https://linkedin.com/company/ainetworkbc,"AI Network of BC (AInBC) is a premier AI community in British Columbia dedicated to advancing AI innovation, education, and collaboration across industries.",AI & Machine Learning,"B2B, SMB",Board Vice,President,Verified
ai-planet,AI Planet,https://aiplanet.com/,https://www.linkedin.com/company/planet-ai,Official website: AI Planet is a global AI community and platform that aims to make AI accessible for all by providing secure and reliable Generative AI (GenAI) solutions for enterprises.,AI & Machine Learning,"B2B, B2C, Enterprise",Chanukya Patnaik,Founder,Verified
ai-robotics-france,AI ROBOTICS FRANCE,https://airobotics.fr/,https://linkedin.com/company/ai-robotics-france,"AI Robotics is a French company specializing in designing and developing advanced intelligent robots for various sectors including hospitality, logistics, industry, healthcare, and retail.",AI & Machine Learning,B2B,N/A,N/A,Verified
ai-silk-corporation,AI SILK CORPORATION,https://digitinstant.com/,https://www.linkedin.com/company/ai-silk-corporation,"Please provide any additional details or alternative name variations for ""AI SILK CORPORATION"" to help locate accurate information.",AI & Machine Learning,B2B,Hideo Okano,CEO,Verified
ai-visionguard-ug,AI VisionGuard UG,https://www.gorilla-technology.com/,https://linkedin.com/company/ai-visionguard,"I could not find specific information about ""AI VisionGuard UG.",SaaS & Cloud Technology,B2B,N/A,N/A,Verified
aistroke,AI,https://www.ai-stroke.com/,https://www.linkedin.com/company/ai/,AI-Stroke uses artificial intelligence and computer vision combined with real-time monitoring to detect strokes as quickly as possible and automatically call emergency services (911).,HealthTech & Biotech,"B2B, SMB",N/A,N/A,Verified
aienergy-inc,AI.Energy Inc.,https://aienergygroup.com/,https://www.linkedin.com/company/aienergy/,AI.Energy Inc. .,SaaS & Cloud Technology,B2B,N/A,N/A,Verified
ailand-hc-gmbh,AI.Land HC GmbH,"https://www.northdata.com/AI.Land+GmbH,+Kempen/Amtsgericht+Krefeld+HRB+18136",https://linkedin.com/company/ai-land-gmbh,AI.Land HC GmbH .,Data Science & Analytics,"B2B, B2C",N/A,N/A,Verified
ai4iv-srl,AI4IV Srl,https://www.ai4iv.com/,https://www.linkedin.com/company/ai4iv-srl,AI4IV Srl is a deep-tech startup operating in advanced microelectronics.,AI & Machine Learning,"B2B, SMB",N/A,N/A,Verified
aichi-prefecture,Aichi Prefecture,https://www.pref.ai/,https://www.linkedin.com/company/aichi-prefecture/,Aichi Prefecture is a regional government entity in Japan located in the Chūbu region of Honshū.,SaaS & Cloud Technology,"B2B, B2C, Enterprise",N/A,N/A,Verified
aida-albania,AIDA,https://www.ai/,https://www.linkedin.com/company/aida-ai/,AIDA Rent-a-Car is a car rental service provider in Albania.,SaaS & Cloud Technology,B2C,N/A,N/A,Verified
aikido-security,Aikido Security,https://www.aikido.de/,https://linkedin.com/company/aikido-security,"Aikido Security is a developer-friendly software security platform that continuously monitors code for known vulnerabilities, CVEs, and other risks.",SaaS & Cloud Technology,"B2B, Enterprise",Willem Delbare,Cofounder,Verified
ailicorn,Ailicorn,https://alicorn.co/,https://www.linkedin.com/company/alicorn-inc,"Alicorn is a company that solves health and productivity problems by providing technology platforms, virtual care services, and data analytics offerings designed for employers, benefits advisors, a...",SaaS & Cloud Technology,B2B,Praveen Mooganur,Founder,Verified
ailytics-limited,Ailytics Limited,https://ailytics.ai/,https://www.linkedin.com/company/ailytics-limited/,Ailytics is a leading video analytics company in Southeast Asia that enhances safety and productivity for operations within the construction and manufacturing industries.,AI & Machine Learning,B2B,N/A,N/A,Verified
aindo,AINDO,https://www.aindo.com/,https://www.linkedin.com/company/aindo/,Aindo provides a Synthetic Data Platform that enables companies to unlock the full potential of their data by generating highly realistic and privacy-respecting synthetic datasets.,AI & Machine Learning,B2B,Daniele Panfilo,CEO,Verified
aineo,AINEO,https://aineo.com/,https://www.linkedin.com/company/aineo-networks,"AINEO delivers cloud-based communications services including cloud phone services, cloud collaboration software, IT consulting, IT support, project management, and technology procurement.",SaaS & Cloud Technology,"B2B, Enterprise",Spencer Wolf,CEO,Verified
ainx-computing-ltda,AINX Computing Ltda,https://www.aifugroup.com/,https://www.linkedin.com/company/ainx,"I currently have no additional details about ""AINX Computing Ltda"" to refine the search.",AI & Machine Learning,B2B,David Chen,Cofounder,Verified
aiola,aiOla,https://aiola.ai/,https://www.linkedin.com/company/aiola,aiOla what does this company do.,AI & Machine Learning,"B2B, Enterprise",Omri Shai,Chief,Verified
aiplux,AIPLUX,https://aiplux.com/,https://www.linkedin.com/company/aiplux,AIPLUX is an innovative legal-tech company specializing in intellectual property (IP) protection.,SaaS & Cloud Technology,"B2B, SMB, SaaS",Alfred Wu,CEO,Verified
aira,Aira,https://www.airahome.com/,https://www.linkedin.com/company/airaio,"Aira is a home energy company focused on clean energy technology, specifically air source heat pumps.",CleanTech & Energy,B2C,Anand Chandrasekher,Cofounder,Verified
aira-corporation,AIRA Corporation,https://airahome.com/,https://www.linkedin.com/company/airacorporation,Aira is a clean energy-tech company focused on bringing heat pumps and home energy-saving solutions to every home.,CleanTech & Energy,"B2B, B2C",Anand Chandrasekher,Cofounder,Verified
airacles,Airacles,https://airacles.com/,https://www.linkedin.com/company/airacles,"Airacles is a wellness and holistic healing company based in Mount Vernon, Ohio, with an official website at.",SaaS & Cloud Technology,B2B,N/A,N/A,Verified
aire-software-fzllc,AIRE Software FZ,https://airespaces.co.uk/,https://www.linkedin.com/company/aireapps,"I have not found specific information about ""AIRE Software FZ-LLC.",SaaS & Cloud Technology,B2B,N/A,N/A,Verified
aireco-co-ltd,"AIRECO Co., Ltd",https://www.aireco.com/,https://www.linkedin.com/company/airecoltd,"Aireco Supply, Inc. Founded in 1952, it offers a wide range of HVAC and refrigeration parts and supplies, including air filters, compressors, vacuum pumps, air cleaners, humidifiers, motor protecto...",SaaS & Cloud Technology,B2B,N/A,N/A,Verified
airinternet,AirInternet,https://ir.ai/,https://linkedin.com/company/qcsairinternet,AirInternet airNet Technology Inc.,Gaming & Media,B2B,Redmond Peel,CEO,Verified
airspider,AIRSPIDER,https://www.airspiders.com/,https://www.linkedin.com/company/airspider,"AIRSPIDER air Spider LLC provides end-to-end digital solutions including website development, iOS and Android apps, eCommerce platforms, ERP systems, recharge services, school management software, ...",SaaS & Cloud Technology,B2B,Glenn Laxdal,President,Verified
airudi,Airudi,https://airudi.com/,https://linkedin.com/company/airudi-inc,Airudi combines AI and HR expertise to design solutions that help companies address operational and HR challenges.,AI & Machine Learning,B2B,Pape Wade,CEO,Verified
airwallex,Airwallex,https://www.airwallex.com/,https://www.linkedin.com/company/airwallex,"Airwallex is a global financial platform that provides business accounts, payment solutions, and spend management tools.",FinTech,"B2B, Enterprise",Jack Zhang,Cofounder,Verified
aitaca,Aitaca,https://aitaca.io/,https://linkedin.com/company/aitaca,Aitaca develops an artificial intelligence platform designed to improve how people shop for fashion and jewelry.,AI & Machine Learning,B2B,Paz Vega,CEO,Verified
aivar,AIVAR,https://aivar.tech/,https://www.linkedin.com/company/aivardz,Here is the detailed verified information about the company AIVAR: 1.,SaaS & Cloud Technology,B2B,Kim Bomin,Founder,Verified
aive,Aive,https://www.aive.com/,https://www.linkedin.com/company/aive,Aive redefines video content production by combining Analytical and Generative AI in a multimodal approach.,SaaS & Cloud Technology,B2B,Olivier Reynaud,CEO,Verified
aivis,Aivis,https://www.f6s.com/company/aivis-inc,https://www.linkedin.com/company/aivis,AIVIS is a medical artificial intelligence (AI) solution development company.,AI & Machine Learning,B2B,Joe Ferraro,President,Verified
aj2-co-ltd,AJ2 Co. Ltd.,http://www.jtwoc.com/,https://www.linkedin.com/company/j2c-co-ltd,"AJ2&J2C provides iris recognition devices, optical components, and software.",SaaS & Cloud Technology,"B2B, Enterprise",Jung Gilsoo,CEO,Verified
akawan,akawan,https://akawan.com/,https://www.linkedin.com/company/akawan,"Akawan is a Toulouse-based agency specializing in the design, development, and maintenance of IT and technical solutions for complex environments.",AI & Machine Learning,B2B,N/A,N/A,Verified
akeneo,Akeneo,https://www.akeneo.com/,https://www.linkedin.com/company/akeneo,Akeneo is a product experience (PX) company and global leader in Product Information Management (PIM).,SaaS & Cloud Technology,"B2B, Enterprise, SaaS",Romain Fouache,CEO,Verified
akidaia-offline-access-control,Akidaia,https://akidaia.com/,https://linkedin.com/company/akidaia,Akidaia offers a non-connected (offline) access control solution that secures physical access anywhere without the need for network connectivity or stored data.,SaaS & Cloud Technology,"B2B, Enterprise",N/A,N/A,Verified
akidaia-offline-access-control,Akidaia – Offline Access Control,https://akidaia.com/,https://linkedin.com/company/akidaia,Akidaia offers a non-connected (offline) access control solution that secures physical access anywhere without the need for network connectivity or stored data.,SaaS & Cloud Technology,B2B,N/A,N/A,Verified
akila,AKILA,https://www.akila3d.com/,https://www.linkedin.com/company/akila3d,Akila is a digital twin platform designed for the ESG era.,SaaS & Cloud Technology,B2B,N/A,N/A,Verified
akivi,Akivi,https://www.akivi.fr/,https://www.linkedin.com/company/sas-akivi/,"Akivi offers an intuitive application called AKIVI (""Anatomical Knowledge In Virtual Immersion"") dedicated to learning human anatomy.",HealthTech & Biotech,"B2B, B2C",Eddie Martucci,Cofounder,Verified
akkodis,Akkodis,https://www.akkodis.com/en/about,https://www.linkedin.com/company/akkodis,Key People: Jan Gupta is the President of Akkodis.,AI & Machine Learning,B2B,Jo Debecker,President,Verified
aktionnaire,Aktionnaire,https://www.aktionnaire.com/,https://linkedin.com/company/aktionnaire,Aktionnaire details: - Official website: com/ - Aktionnaire is a media company that deciphers and explains economics and finance.,FinTech,B2B,N/A,N/A,Verified
alangu-gmbh,alangu GmbH,https://alangu.de/,https://www.linkedin.com/company/alangu-gmbh,"alangu GmbH gmbH develops AI-based translation software for converting text into German Sign Language (Deutsche Gebärdensprache, DGS).",SaaS & Cloud Technology,B2B,Volkan Arikan,CEO,Verified
alatyr,ALATYR,https://www.alatyr.co/,https://www.linkedin.com/company/alatyr/,ALATYR is a world-leading data-driven behavioral insight and change company.,Data Science & Analytics,B2C,Mathieu Gaborit,Cofounder,Verified
alb-investment-corporationdurana,Alb. Investment Corporation/DURANA,https://www.dnb.com/business-directory/company-profiles.al-durra_for_general_trading_and_investment.1a63e249c8ef4af0c937778d4ca19ed2.html,https://linkedin.com/company/the-albanian-investment-corporation,"I have noted that detailed information about ""Alb. Investment Corporation/DURANA"" is limited.",AI & Machine Learning,B2B,Ali Al Baqali,CEO,Verified
albanian-council-4-tech-innovation,Albanian Council 4 Tech &Innovation,https://www.gov.uk/government/news/uk-albania-tech-hub,https://www.linkedin.com/company/albanian-council-for-technology-and-innovation-acti,"The Albanian Council for Technology and Innovation (ACTI) empowers Albania’s tech ecosystem by uniting IT professionals to drive innovation, standards, and the digital future.",SaaS & Cloud Technology,"B2B, SMB",Samir Mane,Founder,Verified
alchimie-data-solutions,Alchimie Data Solutions,https://www.alchimiedatasolutions.com/,https://linkedin.com/company/alchimiedatasolutions,Alchimie Data Solutions specializes in data management and software development.,Data Science & Analytics,"B2B, Enterprise",N/A,N/A,Verified
