Slug,Company Name,Official Website,LinkedIn Profile,Company Description,Industry,Target Customers,CEO/Founder Name,CEO/Founder Title,Data Quality
les-ripeurs,Les Ripeurs,,https://linkedin.com/company/les-ripeurs,Les Ripeurs is a technology company.,Technology,B2B,N/A,N/A,Verified
penny-software,Penny Software,https://www.ourcrowd.com/startup/penny-software,https://www.linkedin.com/company/pennysoftware/?trk=products_details_guest_organization_page,Key people of Penny Software: - CEO and Co-Founder: Iyad Aldalooj - COO and Co-Founder: Majid Aldalooj - CTO and Co-Founder: Mohammed Ibrahim Founding year: 2020 These founders aim to help business...,SaaS & Cloud Technology,B2B,Iyad Aldalooj,Cofounder,Verified
mbaymobility,Mbay'mobility,,https://linkedin.com/company/mbay-mobility,Mbay'mobility is a technology company.,Technology,B2B,Matthew Sellar,CEO,Verified
regeneau,RegenEAU,https://regeneau.com/,https://linkedin.com/company/regeneau,RegenEAU what does this company do.,CleanTech & Energy,B2B,David Pineault,Founder,Verified
sentraflow,SentraFlow,https://www.sentra.io/,https://www.linkedin.com/company/sentra-io,SentraFlow does not appear as a distinct company in the search results.,SaaS & Cloud Technology,"B2B, Enterprise",Yoav Regev,CEO,Verified
openclimat,OpenClimat,https://www.openclimat.com/,N/A,OpenClimat is the first open information platform dedicated to corporate climate action.,SaaS & Cloud Technology,B2B,Vincent Pappolla,CEO,Verified
politico,Politico,,https://www.linkedin.com/company/politico,Politico is a global nonpartisan politics and policy news organization that connects and empowers professionals through journalism and actionable intelligence about European politics and policy.,Gaming & Media,"B2B, B2C",Goli Sheikholeslami,CEO,Verified
greenzy,Greenzy,https://www.dnb.com/business-directory/company-profiles.greenzy.0378777fe8c2c74fc193852a663676b7.html,https://www.linkedin.com/company/greenzy/,Greenzy is an agri-startup focused on pioneering the next agricultural revolution through controlled environment farming methods.,CleanTech & Energy,"B2B, B2C, SMB",Alexis Normand,CEO,Verified
soulcareai,SoulcareAI,https://www.getdeardoc.com/,https://linkedin.com/company/soulcareai,"I have not found verified information about ""SoulcareAI.",HealthTech & Biotech,B2B,Otto Lehnert,Cofounder,Verified
instarlink,Instarlink,,https://www.linkedin.com/company/instarlink/,Instarlink is a technology company.,Technology,B2B,N/A,N/A,Verified
previa-medical,PREVIA MEDICAL,https://www.previa-medical.com/,https://www.linkedin.com/company/previa-medical/,PREVIA MEDICAL develops digital biomarkers that analyze patient data in real-time to identify patients at risk of life-threatening emergencies and immediately alert medical staff.,HealthTech & Biotech,B2B,N/A,N/A,Verified
steerlight,Steerlight,https://steerlight.com/,https://www.linkedin.com/company/steerlight/,SteerLight is a deep tech startup that develops a new generation of LiDAR sensors—laser-based optical systems that perceive the environment in 3D with unparalleled precision and resolution.,SaaS & Cloud Technology,"B2B, SMB",N/A,N/A,Verified
skilled-mapping,Skilled Mapping,https://www.skilledmapping.com/,https://www.linkedin.com/company/skill-mapping,Skilled Mapping is a street-level mobile mapping company specializing in capturing detailed thermal data using advanced measurement tools and AI-driven analysis.,AI & Machine Learning,"B2B, Enterprise",Alex Wrigglesworth,Founder,Verified
outsourced-bookkeeping,Outsourced Bookkeeping,,https://www.linkedin.com/company/outsourced-bookkeeping,Outsourced Bookkeeping is a technology company.,Technology,B2B,Sunil Khullar,President,Verified
mdoc-healthcare-ltd,mDoc Healthcare Ltd.,,https://linkedin.com/company/mymdoc,mDoc Healthcare Ltd. doc Healthcare Ltd. is a technology company.,Technology,B2B,N/A,N/A,Verified
orasis-ear,Orasis,https://www.orasis-ear.com/,https://www.linkedin.com/company/orasis-pharmaceuticals,Orasis-EAR offers technology for neuro-visual health focused on the objective diagnosis and rehabilitation of binocular eye movements.,HealthTech & Biotech,B2B,N/A,N/A,Verified
hec-paris-innovation-entrepreneurship-institute,HEC Paris Innovation & Entrepreneurship Institute,https://hec-innovation-center.reservio.com/,https://www.linkedin.com/company/hec-paris-innovation-entrepreneurship-institute/,"The HEC Paris Innovation & Entrepreneurship Institute supports innovators and entrepreneurs from diverse backgrounds to grow with ambition, efficiency, and impact.",HealthTech & Biotech,"B2B, B2C, Enterprise, SMB",N/A,N/A,Verified
smart-global-governance,Smart Global Governance,https://www.smartglobalgovernance.com/,https://www.linkedin.com/company/smartglobalgovernance,Smart Global Governance develops an integrated risk management platform called Smart GRC.,SaaS & Cloud Technology,"B2B, Enterprise",Olivier Guillo,Founder,Verified
miratlas,Miratlas,https://miratlas.com/,https://www.linkedin.com/company/miratlas/,"Miratlas designs, produces, and sells atmospheric characterization instruments that provide continuous, real-time atmospheric measurements.",SaaS & Cloud Technology,"B2B, Enterprise",Edouard Communal,CEO,Verified
startupflanders-flanders-investment-trade-fit,Startup.Flanders,https://www.startupflanders.com/,N/A,Startup.Flanders - Flanders Investment & Trade (FIT) .,SaaS & Cloud Technology,"B2B, SMB",N/A,N/A,Verified
opus-aerospace,Opus Aerospace,https://www.opus-aerospace.com/,https://www.linkedin.com/company/opusaerospace,"OPUS Aerospace designs, develops, and manufactures economical, ecological, and ergonomic space launch solutions dedicated to nanosatellites and small payloads.",SaaS & Cloud Technology,B2B,Safouane Benamer,CEO,Verified
pliant,Pliant,https://getpliant.com/,https://www.linkedin.com/company/getpliant,Pliant provides app and API-based solutions for issuing credit cards and tracking spending.,FinTech,"B2B, Enterprise",Philippe Vincent,Chief Executive Officer,Verified
rekava,rekava,https://www.rekava.com/,https://www.linkedin.com/company/rekava/,"Rekava is a Ukrainian sustainable brand that crafts premium, environmentally friendly products made from recycled coffee grounds.",CleanTech & Energy,"B2B, B2C",Dmytro Bidyuk,Cofounder,Verified
imanens-bio,ImAnens Bio,,https://www.linkedin.com/company/imanes-bio,ImAnens Bio is a technology company.,Technology,B2B,N/A,N/A,Verified
quiet,QUIET,https://quietcompany.co.uk/,https://linkedin.com/company/wearequiet,Quaker enterprise Quiet Company) Another relevant website:.,Gaming & Media,"B2B, B2C, Enterprise",Andy Wilson,President,Verified
skribi,SKRIBI,https://skrilixglobal.com/,https://www.linkedin.com/company/skribble-trustshapers/,SKRIBI sKRILIX PRIVATE LIMITED specializes in providing top-of-the-line medical equipment to healthcare professionals and people worldwide.,HealthTech & Biotech,B2B,Philipp Dick,CEO,Verified
numalis,NUMALIS,https://numalis.com/,https://www.linkedin.com/company/numalis/,Numalis provides tools and develops ISO standards to facilitate the adoption of AI throughout the industry.,HealthTech & Biotech,B2B,Arnault Ioualalen,CEO,Verified
lockem,LockEM,,https://www.linkedin.com/company/lockem-lda/,LockEM is a technology company.,Technology,B2B,Luis Rosa,Cofounder,Verified
nezedi,Nezedi,https://nezedi.com/,https://www.linkedin.com/company/netzerodigital,"Nezedi Analytics is a software that measures, optimizes, and certifies the environmental impact of digital activities.",Data Science & Analytics,"B2B, Enterprise",Ifty Nasir,Founder,Verified
rgion-pays-de-la-loire,Région Pays de la Loire,https://www.paysdelaloire.fr/,https://linkedin.com/company/region-pays-de-la-loire,"Région Pays de la Loire is a regional government entity in western France responsible for various public missions including economic development, education, transportation, culture, and social serv...",HealthTech & Biotech,B2C,N/A,N/A,Verified
multiscale-solutions,Multiscale Solutions,https://multiscale.tech/,https://www.linkedin.com/company/multiscale-tech,Multiscale Technologies provides an advanced AI platform called MIND that enables organizations to create and manage detailed digital twins of their products and processes.,AI & Machine Learning,"B2B, B2C",Vasu Kalidindi,Cofounder,Verified
optiqb-ai-technology-limited,Optiqb AI technology limited,https://www.optiq.ai/,https://www.linkedin.com/company/optiqai,"It specializes in discovering and classifying data using large language models (LLM), addressing security misconfigurations, analyzing access patterns, and providing remediation steps.",SaaS & Cloud Technology,B2B,Keshav Murthy,CEO,Verified
nabix-soft,Nabix Soft,https://www.mwcbarcelona.com/exhibitors/31476-nabix-soft,https://www.linkedin.com/company/nabixsoft,"Nabix Soft is a leader in full-cycle software development, providing innovative IT solutions primarily for the financial sector, including banking, investment, insurance, telecom, and more.",FinTech,B2B,N/A,N/A,Verified
kauzai,Kauz.ai,,https://www.linkedin.com/company/kauz-gmbh/?originalSubdomain=de,Kauz.ai .,Technology,B2B,Thomas Ruedel,Founder,Verified
sharing-worker,SHARING WORKER,https://www.sharingworker.com/,https://www.linkedin.com/company/sharingworker/,Sharing Worker is specialized in accident prevention on construction sites by creating shared vigilance between humans and machines.,AI & Machine Learning,B2B,N/A,N/A,Verified
lprint,LPRINT,,https://www.linkedin.com/company/lprint,LPRINT is a technology company.,Technology,B2B,Shekhar Gupta,Founder,Verified
kwit,Kwit,,https://linkedin.com/company/kwit,Kwit is a technology company.,Technology,B2B,Geoffrey Kretz,CEO,Verified
simvia,Simvia,https://www.simvia.tech/,https://www.linkedin.com/company/simvia-tech,"Simvia detailed information: 1. Simvia, a subsidiary of the EDF Group, provides open-source numerical simulation solutions to support industrial players in their most complex projects.",SaaS & Cloud Technology,B2B,N/A,N/A,Verified
iziwup,IZIWUP,,https://www.linkedin.com/company/iziwup,IZIWUP is a technology company.,Technology,B2B,N/A,N/A,Verified
nook-care,nook care,https://x.com/nook_care,https://www.linkedin.com/company/nookcare,Nook Care offers a specialized program designed to support individuals in rebuilding their lives after experiencing sexual violence in childhood.,HealthTech & Biotech,B2C,N/A,N/A,Verified
rnb,RNB,https://rnbsolar.co.uk/,https://www.linkedin.com/company/rnb-retail-and-brands-ab,"The detailed information I provided pertains to ""RNB Solar,"" a UK-based company specializing in solar panel installation and maintenance for domestic and commercial sectors.",CleanTech & Energy,B2B,N/A,N/A,Verified
prisme-ai,Prisme AI,https://www.pages.prisme.ai/,https://www.linkedin.com/company/prisme-ai/,Prisme AI .,SaaS & Cloud Technology,"B2B, SMB",Bastien Bouillon,CEO,Verified
metropole-europeenne-de-lille,METROPOLE EUROPEENNE DE LILLE,,https://linkedin.com/company/metropoledelille,METROPOLE EUROPEENNE DE LILLE is a technology company.,Technology,B2B,N/A,N/A,Verified
playruo,Playruo,https://playruo.com/,https://www.linkedin.com/company/playruo,Playruo what does this company do.,SaaS & Cloud Technology,"B2B, B2C, SMB",N/A,N/A,Verified
hivenet,Hivenet,https://www.hivenet.com/,https://www.linkedin.com/company/hivenet,Hivenet detailed information: 1. Hivenet is a Swiss technology company specializing in distributed cloud storage and computing services.,SaaS & Cloud Technology,"B2B, Enterprise",Maximilian Max Pinker,Founder,Verified
ricircola-srl,RI.CIRCOLA S.R.L.,https://www.icribis.com/it/scheda-azienda/MI2595699_RI.CIRCOLA_S.R.L,https://www.linkedin.com/company/ri-circola-srl,RI.CIRCOLA S.R.L. they design circular economy supply chains where the waste of one company becomes secondary raw material for the same or another company.,CleanTech & Energy,"B2B, SMB",N/A,N/A,Verified
smartium-group,SMARTIUM Group,https://www.smartium-group.com/,https://linkedin.com/company/smartium-group,"SMARTIUM Group develops innovative software solutions that integrate artificial intelligence (AI), numerical modeling, and Monte Carlo simulation to optimize physical measurement systems, particula...",AI & Machine Learning,"B2B, SMB",N/A,N/A,Verified
playplay,PlayPlay,https://playplay.com/,https://www.linkedin.com/company/playplay,"PlayPlay is a video creation platform designed for marketing and communication teams to easily create professional, high-quality videos without requiring editing skills.",SaaS & Cloud Technology,"B2B, SaaS",Thibaut Machet,CEO,Verified
luniwave,LUNIWAVE,,https://www.linkedin.com/company/luniwave/,LUNIWAVE is a technology company.,Technology,B2B,N/A,N/A,Verified
metaworldx,MetaWorldX,,https://www.linkedin.com/company/metaworldx/,MetaWorldX is a technology company.,Technology,B2B,Raza Jafri,Founder,Verified
inwink,INWINK,,https://linkedin.com/company/inwink,INWINK is a technology company.,Technology,B2B,N/A,N/A,Verified
saudi-arabia-monshaat,Saudi Arabia,https://www.prnewswire.com/in/news-releases/monshaat-leads-delegation-of-saudi-startups-at-web-summit-2023-301990695.html,https://linkedin.com/company/saudi-arabian-football-federation,Monsha'at (The Small and Medium Enterprises General Authority) is dedicated to promoting entrepreneurship and innovation in Saudi Arabia.,FinTech,"B2B, Enterprise, SMB",N/A,N/A,Verified
safee-sas,SAFEE SAS,https://www.safee.com/security/,https://linkedin.com/company/coques-safee,"SAFEE SAS is a société civile immobilière (real estate civil company) based in Paris, France.",AI & Machine Learning,B2B,N/A,N/A,Verified
loxo-ag,LOXO AG,,https://linkedin.com/company/loxo1,LOXO AG is a technology company.,Technology,B2B,Amin Amini,CEO,Verified
snap-discovery,snap DISCOVERY,https://www.snapdiscovery.de/,N/A,snap DISCOVERY dISCOVERY develops innovative solutions for the future of gaming by enabling direct control of computer and mobile games using thoughts.,AI & Machine Learning,B2B,Evan Spiegel,Cofounder,Verified
korea-creative-content-agency-kocca,Korea Creative Content Agency (KOCCA),,https://www.linkedin.com/company/korea-creative-content-agency,Korea Creative Content Agency (KOCCA) is a technology company.,Technology,B2B,N/A,N/A,Verified
ministre-de-lintrieur,Ministère de l’Intérieur,,https://www.linkedin.com/company/ministere-de-l-interieur/,Ministère de l’Intérieur is a technology company.,Technology,B2B,N/A,N/A,Verified
r8-technologies-o,R8 Technologies OÜ,https://r8tech.io/,https://linkedin.com/company/r8tech,R8 Technologies develops AI-powered solutions for sustainable real estate management.,CleanTech & Energy,B2B,N/A,N/A,Verified
logidoo,Logidoo,,https://linkedin.com/company/2wl,Logidoo is a technology company.,Technology,B2B,N/A,N/A,Verified
healdev,Heal.dev,https://www.heal.de/,https://www.linkedin.com/company/heal-dev,"Heal.dev for the most accurate and updated information about key people and headquarters, checking their LinkedIn page or contacting them directly via their website is recommended.",Gaming & Media,B2B,Scott Vertrees,Chief Executive Officer,Verified
oberon-sciences,OBERON SCIENCES,https://www.minalogic.com/en/member-directory/oberon-sciences/,https://linkedin.com/company/%C5%8Dberon,"OBERON SCIENCES designs, develops, manufactures, and commercializes innovative scientific solutions for environmental measurement and analysis.",HealthTech & Biotech,B2B,N/A,N/A,Verified
supervizor,Supervizor,https://www.supervizor.com/,https://www.linkedin.com/company/supervizor,Supervizor offers a comprehensive financial risk discovery and monitoring platform that connects to ERP and other financial systems to consolidate and standardize financial data.,FinTech,"B2B, Enterprise",Alban Clot,Founder,Verified
scienta-lab,Scienta Lab,,https://www.linkedin.com/company/scienta-lab/,Scienta Lab is a technology company.,Technology,B2B,Camille Bouget,CEO,Verified
saha-robotik,SAHA ROBOTIK,https://www.saharobotik.com/,https://www.linkedin.com/company/saha-robotik/,"Saha Robotik is a robotics company specializing in autonomous mobile service and delivery robots primarily for the hospitality (HORECA), facility operation, and retail industries.",SaaS & Cloud Technology,B2B,Emre Cekic,CEO,Verified
imaginostics,Imaginostics,,https://www.linkedin.com/company/imaginostics,Imaginostics is a technology company.,Technology,B2B,Scientific Co,Founder,Verified
logidot,Logidot,,https://www.linkedin.com/company/logidot,Logidot is a technology company.,Technology,B2B,N/A,N/A,Verified
semeia,Semeia,https://www.semeia.io/,https://www.linkedin.com/company/semeia/,"Semeia sêmeia provides software for medical follow-up and consultation, focusing on patient monitoring solutions designed to support remote medical follow-up and consultation.",HealthTech & Biotech,B2B,Pierre Hornus,Cofounder,Verified
la-fabe,LA FABE,,https://linkedin.com/company/la-fabe,LA FABE is a technology company.,Technology,B2B,N/A,N/A,Verified
minve,MINVE,https://www.ancestry.com/name-origin?surname=minve,N/A,No further specific details about MINVE such as location or industry have been provided.,AI & Machine Learning,B2B,N/A,N/A,Verified
startupgermany-and-frenchgerman-tech-lab,Startup-Germany and French,https://vivatechnology.com/,https://linkedin.com/company/startup-germany-e-v-,Startup-Germany and French-German Tech Lab .,SaaS & Cloud Technology,"B2B, SMB",N/A,N/A,Verified
ringover,Ringover,https://www.ringover.com/,https://www.linkedin.com/company/ringover,"Ringover is a cloud-based communication platform offering voice, video, chat, SMS, and call center solutions for businesses.",SaaS & Cloud Technology,"B2B, Enterprise",Ludovic Rateau,CEO,Verified
okcc,OKCC,http://okcclabs.com/,https://www.linkedin.com/company/theclerksoffice,OKCC what does this company do.,FinTech,B2B,Mautra Staley Jones,President,Verified
roamless-esim,Roamless eSIM,https://roamless.com/,https://www.linkedin.com/company/roamless,Roamless is a mobile app that provides global mobile connectivity solutions for travelers.,SaaS & Cloud Technology,B2C,Emre Demirel,Cofounder,Verified
sente-sa,SENTE S.A,https://sentelabs.com/,https://www.linkedin.com/company/sente-inc,SENTE S.A .,HealthTech & Biotech,"B2B, B2C",N/A,N/A,Verified
ouwba,ouwba,https://www.ouwba.com/,https://linkedin.com/company/ouwba-certification,"Ouwba automates ISO 27001 compliance, helping businesses focus on growth by simplifying and accelerating the certification process.",Data Science & Analytics,"B2B, SMB",N/A,N/A,Verified
secdojo,SecDojo,https://sec-dojo.com/,https://www.linkedin.com/company/secdojo,SecDojo is a cybersecurity training platform that acts like a flight simulator for cybersecurity and IT professionals.,SaaS & Cloud Technology,"B2B, Enterprise",Younes Benzagmout,CEO,Verified
noxon,Noxon,https://noxon.com/,https://linkedin.com/company/noxongmbh,"There are multiple companies named ""Noxon"" with distinct profiles.",HealthTech & Biotech,"B2B, B2C, SMB",Jens Johansson,CEO,Verified
oboworld,OBOWORLD,http://obo-world.com/,https://www.linkedin.com/company/oboglobal,OBOWORLD detailed information: 1. Obo World offers innovative digital solutions based on artificial intelligence (AI) and an inclusive virtual agent named Obo.,AI & Machine Learning,B2B,N/A,N/A,Verified
groupe-sncf,GROUPE SNCF,https://www.groupe-sncf.com/,https://www.linkedin.com/company/sncf,"It offers a full range of mobility solutions across multiple business lines including passenger transport, freight forwarding, contract logistics, distribution & express, road transport, and supply...",SaaS & Cloud Technology,"B2B, B2C, Enterprise",N/A,N/A,Verified
ic2x-conseil,IC2X Conseil,,https://www.linkedin.com/company/icconseil/,IC2X Conseil is a technology company.,Technology,B2B,N/A,N/A,Verified
helio-water,HELIO WATER,https://www.heliowater.com/,https://www.linkedin.com/company/helio-water/,"Helio Water has designed a completely autonomous module called HELIO that transforms any type of water, including seawater, into pure drinking water using solar distillation.",CleanTech & Energy,"B2B, B2C",N/A,N/A,Verified
scialytics,Scialytics,https://www.alternup-medical.com/en/10-scialytics,https://www.linkedin.com/company/scialytics,"Yes, please assist in searching for more specific information about the key people (CEO, CTO, founders) and the exact founding date of Scialytics.",AI & Machine Learning,B2B,N/A,N/A,Verified
mycophyto,MYCOPHYTO,https://www.mycophyto.fr/,https://www.linkedin.com/company/mycophyto,MYCOPHYTO develops biological solutions for regenerative agriculture.,AI & Machine Learning,"B2B, Enterprise",Justine Lipuma,CEO,Verified
nikola-tesla-innovation-hub,Nikola Tesla Innovation Hub,https://www.emporis.com/buildings/152728/nikola-tesla-innovation-hub-miami-fl-usa,https://www.linkedin.com/company/nikola-tesla-innovation-hub/,Innovation Centre Nikola Tesla - ICENT) 2. Innovation Centre Nikola Tesla (ICENT) is a technology transfer and research institution acting as an innovation incubator.,AI & Machine Learning,"B2B, SMB",N/A,N/A,Verified
rawa-emirati-wellness,RAWA | Emirati Wellness,https://www.rawa.ai/,https://www.linkedin.com/company/rawa-secrets,"Rawa empowers content creation with AI-driven solutions, including AI characters representing Saudi, Kuwaiti, Emirati, and international cultures.",SaaS & Cloud Technology,B2B,Raya Dahdah,Founder,Verified
moov-insights,MOOV INSIGHTS,https://moov.io/,N/A,"Moov is a fintech company building a modern payments software stack that is powerful, easy to use, and beautifully designed.",FinTech,B2B,Wade Arnold,CEO,Verified
mbaymi-connect,MBAY’MI CONNECT,,https://linkedin.com/company/connect-mi,MBAY’MI CONNECT is a technology company.,Technology,B2B,N/A,N/A,Verified
keyros,Keyros,,https://www.linkedin.com/company/keyros/,Keyros is a technology company.,Technology,B2B,N/A,N/A,Verified
mover,MoveR,https://getamover.co.uk/,https://www.linkedin.com/company/mover,MoveR (Getamover) connects customers with removal and moving companies through an advanced matching system.,SaaS & Cloud Technology,"B2B, B2C",N/A,N/A,Verified
inicio,Inicio,,https://www.linkedin.com/company/go-inicio,Inicio is a technology company.,Technology,B2B,N/A,N/A,Verified
liberfit,Liberfit,,https://www.linkedin.com/company/liberfit/,Liberfit is a technology company.,Technology,B2B,N/A,N/A,Verified
orion-score,Orion Score,https://www.orionscore.com/,https://www.linkedin.com/company/orion-score,Orion Score enables startup founders to score their startup for investability.,Data Science & Analytics,"B2B, SMB",Brian Bronson,Chief Executive Officer,Verified
markedroid,MarkeDroid,,https://linkedin.com/company/markedroid,MarkeDroid is a technology company.,Technology,B2B,Toomas Teesaar,CEO,Verified
sw-chemicals-co-ltd,"SW Chemicals Co., Ltd.",http://www.swchemicals.com/,https://www.linkedin.com/company/sk-chemicals,"SW Chemicals specializes in the production and application of nanodiamonds, which are next-generation advanced materials.",SaaS & Cloud Technology,B2B,N/A,N/A,Verified
safeout,Safeout,https://www.safeout.io/,https://www.linkedin.com/company/safeout-io,Safeout provides an end-to-end product traceability platform that uses advanced digital tracking technology to create a transparent and unbroken chain of product authenticity and accountability acr...,FinTech,"B2B, B2C",Samir Naggara,Cofounder,Verified
mrc-riviredunord,MRC Rivière-du,https://mrcppureagents.dundee.ac.uk/,https://www.linkedin.com/company/mrc-de-riviere-du-loup,"I could not find specific information about ""MRC Rivière-du-Nord.",AI & Machine Learning,B2B,N/A,N/A,Verified
midas-analytics,Midas Analytics,,https://linkedin.com/company/midasanalyticsai,Midas Analytics is a technology company.,Technology,B2B,Alan Feldman,President,Verified
green-whyz-media,Green Whyz Media,https://www.greenmediaworks.com/,N/A,"No verified information about ""Green Whyz Media"" is currently available.",SaaS & Cloud Technology,B2B,N/A,N/A,Verified
opensee,Opensee,https://opensea.io/,https://www.linkedin.com/company/opensee,Opensee openSea is the world's first and largest web3 marketplace for non-fungible tokens (NFTs) and crypto collectibles.,FinTech,"B2C, Enterprise",N/A,N/A,Verified
outmind,Outmind,https://en.outmind.ai/,https://linkedin.com/company/outmind-app,Outmind is a SaaS company that offers an AI-powered internal search engine integrating with all of a user's tools (e.,AI & Machine Learning,"B2B, Enterprise, SaaS",Grace Mehrabe,Cofounder,Verified
stonedrum,Stonedrum,https://stonedrum.co/,https://www.linkedin.com/company/stonedrum,StoneDrum crafts the world's first and only patented snare drums made from natural stone.,AI & Machine Learning,B2C,N/A,N/A,Verified
nina,NINA,https://www.ninaricci.com/,https://www.linkedin.com/company/nina,"NINA is associated with Nina Ricci, a brand under Puig, a global company in the premium beauty industry.",Fashion & Retail,B2C,N/A,N/A,Verified
igonogo,IGONOGO,,https://linkedin.com/company/igonogo,IGONOGO is a technology company.,Technology,B2B,N/A,N/A,Verified
hicool-allinone-startup-platform,HICOOL All-in,https://www.hicool.com/,https://www.linkedin.com/company/hicoolglobal,HICOOL is an all-in-one startup ecosystem platform established in 2020 and managed by the Beijing Overseas Talents Association.,SaaS & Cloud Technology,"B2B, SMB",David Qiangbin Zhu,Founder,Verified
quadtech,QUADTECH,https://quadtech.com/,https://www.linkedin.com/company/quadtech,"QuadTech provides automated electrical safety testing equipment and solutions, including Hipot testers, LCR meters, megohmmeters, and milliohmmeters.",SaaS & Cloud Technology,B2B,Fred Sabatine is,President,Verified
