Slug,Company Name,Official Website,LinkedIn Profile,Company Description,Industry,Target Customers,CEO/Founder Name,CEO/Founder Title,Data Quality
metis-therapeutics-hk-limited,Metis Therapeutics HK Limited,,https://www.linkedin.com/company/metistx,Metis Therapeutics HK Limited is a technology company.,Technology,B2B,N/A,N/A,Verified
hahn-softwareentwicklung-gmbh,Hahn Softwareentwicklung GmbH,https://www.hahn-software.io/,https://linkedin.com/company/hahn-softwareentwicklung,"Hahn Softwareentwicklung GmbH is an expert in artificial intelligence and customized software development, project management, data, and AI.",AI & Machine Learning,"B2B, Enterprise",N/A,N/A,Verified
moreapp,MoreApp,https://moreapp.com/,https://linkedin.com/company/moreapp,"What MoreApp does: MoreApp is a platform that allows companies to digitize forms and replace paper forms with digital work orders, inspections, audits, reports, evaluations, surveys, and more.",SaaS & Cloud Technology,B2B,Thom Bokelaar,CEO,Verified
sqrrl-spinoff-of-minervasys,Sqrrl (spinoff of MinervaSys),https://sqrrl.com/,https://www.linkedin.com/company/sqrrl,"Note: Sqrrl Data, Inc.",SaaS & Cloud Technology,"B2B, Enterprise",Mark Terenzoni,CEO,Verified
ratp-group,RATP GROUP,https://ratpgroup.com/,https://www.linkedin.com/company/ratp,RATP Group is the world's 3rd largest urban transport operator.,SaaS & Cloud Technology,"B2B, B2C",N/A,N/A,Verified
reeverse-systems,Reeverse Systems,https://www.osmiowater.co.uk/,https://linkedin.com/company/reeverse-systems,"I couldn't find verified information about ""Reeverse Systems,"" indicating it may be lesser-known or have limited online presence.",SaaS & Cloud Technology,B2B,N/A,N/A,Verified
projeqtor,PROJEQTOR,https://www.projeqtor.net/,https://linkedin.com/company/projeqtor,ProjeQtOr is a project management software company that offers a quality-based project organizer tool designed by project managers for project managers.,SaaS & Cloud Technology,B2B,N/A,N/A,Verified
ntt-data,NTT DATA,https://www.nttdata.com/,https://www.linkedin.com/company/nttdata,"NTT DATA provides innovative business and technology solutions to help organizations optimize, transform, and innovate.",SaaS & Cloud Technology,"B2B, Enterprise",N/A,N/A,Verified
oraclase,Oraclase,https://www.e-borghi.com/,https://www.linkedin.com/company/oracle,"No verifiable information or official website could be found for a company named ""Oraclase.",AI & Machine Learning,B2B,Safra Catz,CEO,Verified
spendbase,Spendbase,https://www.spendbase.co/,https://www.linkedin.com/company/spendbase,"Spendbase is a SaaS subscription management platform that helps companies track, optimize, and reduce software costs.",SaaS & Cloud Technology,"B2B, Enterprise, SaaS",Andrew Alexseyenko,Founder,Verified
quideos,QUIDEOS,https://quideos.com/,https://www.linkedin.com/company/quideos/,"Quideos develops innovative hedging products to secure the prices of all agricultural raw materials (including meat, fish, fruits, vegetables).",FoodTech,"B2B, B2C",N/A,N/A,Verified
qarnot-computing,Qarnot Computing,https://qarnot.com/,https://www.linkedin.com/company/qarnot/,Qarnot Computing provides a unique solution that combines high-performance computing with eco-friendly heating.,SaaS & Cloud Technology,B2B,Paul Benoit,CEO,Verified
superprof,Superprof,https://www.superprof.com/,https://www.linkedin.com/company/superprof,"Superprof is a platform dedicated to knowledge sharing that connects students with private tutors, coaches, artists, and mentors across more than 1200 subjects.",SaaS & Cloud Technology,B2C,Wilfried Granier,Cofounder,Verified
medusoil-sa,Medusoil SA,,https://www.linkedin.com/company/medusoil/,Medusoil SA is a technology company.,Technology,B2B,N/A,N/A,Verified
sustamize-gmbh,sustamize GmbH,https://www.sustamize.com/,https://linkedin.com/company/sustamize,"sustamize GmbH gmbH is a ClimateTech startup that enables companies to measure, optimize, and manage product and value chain carbon footprints.",SaaS & Cloud Technology,"B2B, SMB",Viola Hasani,Cofounder,Verified
resmonics-ag,Resmonics AG,https://www.resmonics.ai/,https://www.linkedin.com/company/resmonics/,Resmonics AG develops ambient acoustic artificial intelligence technology to empower employee health and productivity by detecting symptoms of infectious lung diseases.,AI & Machine Learning,B2B,Peter Tinschert,CEO,Verified
iglobe-scientific-sas,iGlobe Scientific SAS,,https://www.linkedin.com/company/iglobe-scientific,iGlobe Scientific SAS globe Scientific SAS is a technology company.,Technology,B2B,N/A,N/A,Verified
macnica-atd-europe,Macnica ATD Europe,,https://linkedin.com/company/macnica-atd-europe-1,Macnica ATD Europe is a technology company.,Technology,B2B,Shoichi Teshiba,CEO,Verified
smart-engine,Smart Engine,https://www.biometricupdate.com/companies/smart-engines,https://www.linkedin.com/company/smart-engines,Smart Engine is a provider of cloud-based digital marketing and advertising solutions for payment platforms.,SaaS & Cloud Technology,"B2B, B2C",N/A,N/A,Verified
le-catalyst,LE CATALYST,,https://www.linkedin.com/company/le-catalyst,LE CATALYST is a technology company.,Technology,B2B,Jennifer McCollum,President,Verified
revolty,Revolty,https://www.reddit.com/r/discordapp/comments/148e41u/why_revolt/,https://www.linkedin.com/company/revolty,"I found no specific company named ""Revolty. It offers text channels, voice chat, mod tools, and fine-grained permissions.",AI & Machine Learning,B2C,Detavio Samuels,CEO,Verified
ohmyseason,Ohmyseason,https://ohmyseason.fr/,https://linkedin.com/company/ohmyseason,Ohmyseason is a platform dedicated to lodged seasonal jobs.,SaaS & Cloud Technology,"B2B, B2C",N/A,N/A,Verified
lokk,Lokk,,https://linkedin.com/company/lokk-ug-haftungsbeschränkt,Lokk is a technology company.,Technology,B2B,N/A,N/A,Verified
kerys-software,KERYS Software,,https://linkedin.com/company/kerys-software,KERYS Software is a technology company.,Technology,B2B,N/A,N/A,Verified
imtech,IM'TECH,,https://www.linkedin.com/company/imtech,IM'TECH is a technology company.,Technology,B2B,N/A,N/A,Verified
ict-cloud-computing-services-gmbh,ICT CLOUD COMPUTING SERVICES GMBH,,https://linkedin.com/company/ictcloud,ICT CLOUD COMPUTING SERVICES GMBH is a technology company.,Technology,B2B,N/A,N/A,Verified
siradel,Siradel,https://www.siradel.com/,https://linkedin.com/company/siradel,"Siradel provides digital technologies and solutions for geospatial intelligence, specializing in 3D modeling, digital twins, simulation, and AI to help telecom, industry, and local/regional governm...",CleanTech & Energy,"B2B, Enterprise",Laurent Bouillot,Cofounder,Verified
korea-sports-promotion-foundation,Korea Sports Promotion Foundation,,https://www.linkedin.com/company/korea-sports-promotion-foundation/,Korea Sports Promotion Foundation is a technology company.,Technology,B2B,N/A,N/A,Verified
mindsets-education,Mindsets Education,,https://www.linkedin.com/company/mindsets-learning,Mindsets Education is a technology company.,Technology,B2B,Scott Shickler,Founder,Verified
infrafon-gmbh,Infrafon GmbH,,https://linkedin.com/company/infrafon,Infrafon GmbH is a technology company.,Technology,B2B,Frieder Hansen,Founder,Verified
kopherbit-co-ltd,"KopherBit Co., Ltd.",,https://linkedin.com/company/kopherbit,KopherBit Co. is a technology company.,Technology,B2B,N/A,N/A,Verified
oyo-communities,Oyo Communities,https://www.oyorooms.com/,https://www.linkedin.com/company/oyo-communities,OYO is a global platform that empowers entrepreneurs and small businesses with hotels and homes by providing full-stack technology products and services.,SaaS & Cloud Technology,"B2B, B2C, SMB",Ritesh Agarwal,Founder,Verified
manifest,MANIFEST,,https://www.linkedin.com/company/manifestcyber,MANIFEST is a technology company.,Technology,B2B,Marc Frankel,CEO,Verified
rofim,Rofim,https://www.rofim.fr/,https://www.linkedin.com/company/rofim-doctor/,What does this company do. Rofim is a telemedicine platform that provides secure collaborative medical diagnostic services for healthcare professionals.,HealthTech & Biotech,B2B,Emilie Mercadal,CEO,Verified
klaimy,Klaimy,,https://www.linkedin.com/company/klaimy/,Klaimy is a technology company.,Technology,B2B,Amira Nakouri,CEO,Verified
nunox-technology,NunoX Technology,https://nunox.io/,https://www.linkedin.com/company/nunox,NunoX is a material digitization company that uses AI technology combined with advanced 3D scanning to create precise digital textile twins.,CleanTech & Energy,B2B,N/A,N/A,Verified
mendo,Mendo,,https://www.linkedin.com/company/mendo/,Mendo is a technology company.,Technology,B2B,Quentin Amaudry,CEO,Verified
persistent-systems,Persistent Systems,https://www.persistent.com/,https://www.linkedin.com/company/persistent-systems,"Persistent Systems is a global leader in digital transformation and enterprise modernization, with over 35 years of expertise.",SaaS & Cloud Technology,"B2B, Enterprise",N/A,N/A,Verified
rsight,RSight®,https://www.rsight.com/,https://linkedin.com/company/rsight,"RSight® is an Artificial Intelligence (AI) platform that revolutionizes recruitment by assisting organizations in finding the right talents with simplicity, rapidity, transparency, cost efficiency,...",AI & Machine Learning,"B2B, B2C, Enterprise",Philippe Beucher,Founder,Verified
inpi,INPI,,https://linkedin.com/company/inpifrance,INPI is a technology company.,Technology,B2B,N/A,N/A,Verified
startupteam-bochum,Startup,https://www.bochum-startup.de/,https://www.linkedin.com/company/startup-company,"Startup-Team Bochum supports entrepreneurs in Bochum with company founding, developing business models, scaling, and growth.",Gaming & Media,"B2B, SMB",N/A,N/A,Verified
social-thingum-social-things-srl,Social Thingum (Social Things Srl),https://dispensed.co.uk/,https://linkedin.com/company/social-thingum,"Social Thingum® develops innovative ICT solutions and algorithms in artificial intelligence, Internet of Things (IoT), social e-learning, cloud computing, and human-computer interaction.",AI & Machine Learning,B2B,N/A,N/A,Verified
ruhrhub,ruhrHUB,https://ruhrhub.de/,https://www.linkedin.com/company/ruhr-hub-gmbh/,ruhrHUB what does the company do.,CleanTech & Energy,B2B,Oliver Weimann,CEO,Verified
idgeo,IDGeo,,https://linkedin.com/company/idgeo,IDGeo is a technology company.,Technology,B2B,Ronan Campos,CEO,Verified
parentally,Parentally,https://www.parentaly.com/,https://linkedin.com/company/parentally,"Parentally what does the company do: Parentaly helps companies improve the parental leave experience for employees through career coaching, manager training, and toolkits that support the planning ...",SaaS & Cloud Technology,B2B,Roshni Mahtani Cheung,Founder,Verified
muchbetterai,muchbetter.ai,https://muchbetter.ai/,https://linkedin.com/company/muchbetter-ai,It provides active practice through automatic role-playing exercises with AI-generated clients.,AI & Machine Learning,B2B,Jens Bader,Founder,Verified
humanperf,HUMANPERF,,https://linkedin.com/company/humanperf-software,HUMANPERF is a technology company.,Technology,B2B,Tamer Hassan,Cofounder,Verified
green-power-plus,Green Power Plus,https://www.orientgreenpower.com/,https://www.linkedin.com/company/green-power-technologie/,"Please provide more specific details about the ""Green Power Plus"" company, such as its location or the specific services it offers, to help narrow down the search and find accurate information.",SaaS & Cloud Technology,B2B,N/A,N/A,Verified
squaremiles,SquareMiles,https://shop.squaremilecoffee.com/,https://www.linkedin.com/company/square-miles-financial-services,SquareMiles a multi-award-winning speciality coffee roasting company based in East London.,FoodTech,"B2B, B2C",N/A,N/A,Verified
spin-analytics,SPIN Analytics,https://spin-analytics.com/,https://www.linkedin.com/company/spin-analytics,"SPIN Analytics develops RISKROBOT™, a credit risk management and modeling platform that automates the credit risk model development lifecycle.",Data Science & Analytics,"B2B, Enterprise",Panos Skliamis,CEO,Verified
lecturer,Lecturer,,https://www.linkedin.com/company/lecturer,Lecturer is a technology company.,Technology,B2B,N/A,N/A,Verified
oyolloo,Oyolloo,https://www.oyolloo.com/,https://www.linkedin.com/company/oyolloo,"What does this company do. Oyolloo is a full-stack design and marketing agency offering a wide range of creative services including UI/UX design, logo design, landing page design, branding, SEO, di...",FinTech,"B2B, Enterprise",N/A,N/A,Verified
greenbids,Greenbids,https://www.greenbids.ai/,https://www.linkedin.com/company/greenbids,Greenbids is an AI-powered media buying optimization platform that enhances digital advertising performance while reducing carbon emissions.,SaaS & Cloud Technology,"B2B, Enterprise",Guillaume Grimbert,CEO,Verified
smoretalk-inc,"Smoretalk, Inc",https://flamel.app/,https://linkedin.com/company/smoretalk,"Smoretalk, Inc what does this company do. is an AI-based design company operating an AI design platform called ""Flamel"" and an image editing tool called ""Urimg.",AI & Machine Learning,"B2B, B2C",N/A,N/A,Verified
quwak,Quwak,https://quwak.com/,https://www.linkedin.com/company/quwak,"Quwak operates an identity authentication platform called ""QuwakMe.",SaaS & Cloud Technology,"B2B, Enterprise",Alon Lev,Cofounder,Verified
okular-logistics,Okular Logistics,,https://www.linkedin.com/company/okular-logistics,Okular Logistics is a technology company.,Technology,B2B,Rodolphe Vogt,CEO,Verified
raidium,Raidium,https://radiumbox.com/,https://www.linkedin.com/company/raidium/,"It offers an eCommerce platform for biometric devices, software and RD services via web and mobile applications, facilitating instant access and electronic delivery.",SaaS & Cloud Technology,B2B,Paul Herent,Cofounder,Verified
karomia,Karomia,,https://www.linkedin.com/company/karomia,Karomia is a technology company.,Technology,B2B,Vilva Natarajan,CEO,Verified
sophronitis,Sophronitis,https://sophronitis.com/,https://www.linkedin.com/company/sophronitis,Sophronitis is a mobile application focused on well-being and personal development through the practice of sophrology.,SaaS & Cloud Technology,B2C,Kyrill Asatur,Cofounder,Verified
itesoft,ITESOFT,,https://www.linkedin.com/company/itesoft/,ITESOFT is a technology company.,Technology,B2B,Didier Charpentier,Founder,Verified
ionnyk,Ionnyk,,https://linkedin.com/company/ionnyk,Ionnyk is a technology company.,Technology,B2B,Mathieu Demeuse,Cofounder,Verified
ministres-amnagement-du-territoire-et-transition-e,Ministères Aménagement du territoire et Transition ecologique,https://www.ecologie.gouv.fr/,https://www.linkedin.com/company/ministere-de-la-transition-ecologique/,"The Ministères Aménagement du territoire et Transition écologique are French government ministries responsible for implementing government policies in areas such as ecological transition, climate c...",CleanTech & Energy,"B2B, B2C",N/A,N/A,Verified
ibm,IBM,,https://www.linkedin.com/company/ibm,IBM is a technology company.,Technology,B2B,N/A,N/A,Verified
living-optics-limited,Living Optics Limited,,https://linkedin.com/company/livingoptics,Living Optics Limited is a technology company.,Technology,B2B,N/A,N/A,Verified
kaomx,KaomX,,https://www.linkedin.com/company/kaomx/,KaomX is a technology company.,Technology,B2B,N/A,N/A,Verified
pegascy,Pegascy,https://pegascy-group.com/,https://www.linkedin.com/company/pegascy/,Pegascy develops molecules intended for oncology by acquiring or licensing innovative molecules across multiple cancer indications.,HealthTech & Biotech,B2B,Paul Alves,CEO,Verified
qunasys,QunaSys,https://qunasys.com/,https://www.linkedin.com/company/qunasys,"QunaSys develops technology to maximize the potential of quantum computers, focusing on quantum algorithms and software for quantum chemical calculations.",SaaS & Cloud Technology,"B2B, Enterprise",Tennin Yan,CEO,Verified
laborelec-sa,Laborelec SA,,https://www.linkedin.com/company/engie-laborelec/,Laborelec SA is a technology company.,Technology,B2B,Luc Goossens,CEO,Verified
mirscience-therapeutics,Mirscience Therapeutics,https://mirsciencetx.com/,https://www.linkedin.com/company/mirscience-therapeutics,"Mirscience Therapeutics is a precision medicine start-up that develops therapies for lifelong illnesses such as frailty and muscle atrophy, metabolic diseases like non-alcoholic fatty liver disease...",HealthTech & Biotech,"B2B, B2C",Lucas Ariel Rocha,Founder,Verified
haupper,Haupper,https://www.racius.com/haupper-lda/,https://linkedin.com/company/haupper,Haupper is a European RegTech company specializing in compliance and regulatory solutions for the financial sector.,FinTech,B2B,Brian Effron,Founder,Verified
loire-games,Loire Games,,https://www.linkedin.com/company/loire-games,Loire Games is a technology company.,Technology,B2B,N/A,N/A,Verified
imunotera,ImunoTera,,https://linkedin.com/company/imunotera,ImunoTera is a technology company.,Technology,B2B,N/A,N/A,Verified
scienceone,ScienceOne,https://scienceone.creator-spring.com/,https://www.linkedin.com/company/scienceone/,ScienceOne is an AI-powered professional platform for life sciences that promotes and interconnects talented people and organizations within the life sciences sector.,SaaS & Cloud Technology,B2B,Michael Jones,CEO,Verified
supermicro,Supermicro,https://www.supermicro.com/,https://www.linkedin.com/company/supermicro,"Key people of Supermicro: - Charles Liang: Founder, President, Chief Executive Officer, and Chairman of the Board since inception.",FinTech,B2B,Senior Vice,President,Verified
greenoco,Greenoco,https://greenoco.io/,https://linkedin.com/company/greenoco,"Greenoco provides solutions to measure and reduce the carbon footprint of digital activities, specifically focusing on websites.",SaaS & Cloud Technology,"B2B, SaaS",Anil Kumar Chalamalasetty,Founder,Verified
qfluidics,QFLUIDICS,https://www.qfluidics.com/,https://www.linkedin.com/company/qfluidics,Qfluidics develops custom innovative continuous flow reactors capable of handling solids and viscous reaction media for fine chemical and pharmaceutical productions.,HealthTech & Biotech,B2B,Vincent Marichez,President,Verified
lium,LIUM,,https://www.linkedin.com/company/lium-tech,LIUM is a technology company.,Technology,B2B,N/A,N/A,Verified
libertify,Libertify,,https://www.linkedin.com/company/libertyfi/,Libertify is a technology company.,Technology,B2B,Steve Rosenblum,Founder,Verified
mapla-biotech,Mapla Biotech,,https://linkedin.com/company/maple-biotech-pvt-ltd-,Mapla Biotech is a technology company.,Technology,B2B,N/A,N/A,Verified
poland-lower-silesia,Poland,https://www.wikitree.com/wiki/Space:Lower_Silesia_Voivodeship,https://linkedin.com/company/startup-poland,"Poland - Lower Silesia"" is a geographical region, not a company.",AI & Machine Learning,B2B,Karol Nawrocki,President,Verified
gled-global-education,GLED Global Education,http://www.gled.co/,https://www.linkedin.com/company/gled---global-education-corp,GLED - Global Education Corp.,HealthTech & Biotech,B2C,William Herrera,President,Verified
gk-concept,GK Concept,https://ggservers.com/,https://www.linkedin.com/company/gk-concept,"I do not have additional details about ""GK Concept.",AI & Machine Learning,B2B,Arthur Hagiage,CEO,Verified
semiblocks-bv,SemiBlocks B.V.,https://semiblocks.com/,https://www.linkedin.com/company/semiblocks,"SemiBlocks develops advanced crystal oscillator technology for timing applications, particularly for 5G, atomic clocks, and Positioning, Navigation, and Timing (PNT).",SaaS & Cloud Technology,B2B,N/A,N/A,Verified
optimeyes,Optimeyes,https://optimeyes.ai/,,"There are two companies named ""Optimeyes"" with distinct profiles: 1.",HealthTech & Biotech,"B2B, Enterprise, SaaS",N/A,N/A,
td-synnex,TD SYNNEX,https://www.tdsynnex.com/,https://www.linkedin.com/company/tdsynnex,TD SYNNEX is a leading global distributor and solutions aggregator for the IT ecosystem.,SaaS & Cloud Technology,B2B,Patrick Zammit,Chief Executive Officer,Verified
miraiku,Miraiku,https://miraiku.ai/,https://www.linkedin.com/company/miraiku.ai,"Miraiku is a next-gen GenAI-native tech startup that builds cutting-edge SaaS products to help businesses unlock new levels of insight, creativity, and brand intelligence powered by their native Ge...",SaaS & Cloud Technology,"B2B, B2C, SMB, SaaS",N/A,N/A,Verified
qubec-tech,Québec Tech,https://www.quebectech.com/,https://linkedin.com/company/quebectech,Québec Tech is an organization focused on the success of tech startups in Quebec.,Data Science & Analytics,"B2B, SMB",N/A,N/A,Verified
mopinion,Mopinion,https://mopinion.com/,https://www.linkedin.com/company/mopinion,"Mopinion provides an all-in-one user feedback platform for digital channels such as websites, mobile apps, and email.",Data Science & Analytics,"B2B, Enterprise, SaaS",Kees Wolters,Cofounder,Verified
qubitrium,Qubitrium,https://qubitrium.tech/,https://www.linkedin.com/company/qubitrium,"Qubitrium develops advanced quantum technologies focusing on quantum cryptography, quantum communication, and quantum sensing.",SaaS & Cloud Technology,B2B,Kadir Durak,CEO,Verified
reversed-ventures,Reversed Ventures,https://www.reverseventures.io/,https://linkedin.com/company/reversed-ventures,"Yes, please proceed with searching for detailed information about Reversed Ventures, including key personnel and headquarters, on business directories and LinkedIn.",AI & Machine Learning,B2B,N/A,N/A,Verified
necton,NECTON,https://www.necton.com/,https://linkedin.com/company/necton,Necton Investimentos offers personalized investment services to create high-level portfolios.,SaaS & Cloud Technology,"B2B, B2C",Marcos Azer Maluf,Founder,Verified
tailor-tech,TAILOR TECH,https://www.tailor.tech/,https://www.linkedin.com/company/tailortech,"Tailor offers a customizable, headless ERP platform designed for modern business operations.",SaaS & Cloud Technology,"B2B, Enterprise, SMB",Premjeet Singh,Founder,Verified
rgion-auvergnerhnes-alpes,Région Auvergne,https://www.auvergnerhonealpes.fr/,https://linkedin.com/company/auvergne-rhone-alpes,"Région Auvergne-Rhône-Alpes is an administrative region in southeast-central France, created by the merger of Auvergne and Rhône-Alpes in 2016.",SaaS & Cloud Technology,"B2B, B2C",N/A,N/A,Verified
osedea,OSEDEA,,https://www.linkedin.com/company/osedea,OSEDEA is a technology company.,Technology,B2B,Martin Coulombe,President,Verified
seegenio,SEEGENIO,https://www.seegene.com/,https://www.linkedin.com/company/seegene-inc,SEEGENIO seegene Inc. is a South Korean company specializing in molecular diagnostics products and solutions.,HealthTech & Biotech,B2B,N/A,N/A,Verified
safebear,Safebear,https://safebear.ai/,https://www.linkedin.com/company/safebearapp/,SafeBear is a French startup founded in 2022 that uses artificial intelligence to combat cyberbullying.,AI & Machine Learning,"B2C, SMB",Sagar Jethani,President,Verified
sp3d,SP3D,https://sp3d.co/,https://www.linkedin.com/company/sp3d/,SP3D (Smart Plant 3D) is a highly integrated 3D modeling software solution developed by Intergraph (now part of Hexagon AB).,SaaS & Cloud Technology,B2B,Byron Kennedy,CEO,Verified
robocc,Rob'Occ,https://www.robocc.fr/,https://linkedin.com/company/robocc,Rob'Occ designs and manufactures a new generation of autonomous indoor mobile robots.,SaaS & Cloud Technology,"B2B, Enterprise, SMB",N/A,N/A,Verified
rdc-acoriss-sarl,RDC,http://rdcsrl.com/,https://www.linkedin.com/company/rdc-group-inc,RDC - Rubber Dispersion Chemicals (RDC S.,SaaS & Cloud Technology,B2B,N/A,N/A,Verified
laika-by-aitem,LAIKA By AITEM,,https://www.linkedin.com/company/aitemsolutions/,LAIKA By AITEM is a technology company.,Technology,B2B,N/A,N/A,Verified
symalean,SYMALEAN,https://www.symalean.com/,https://linkedin.com/company/symalean-logiciel,"Symalean develops lean management software designed to streamline quality, health, safety, and environmental (QHSE) procedures.",SaaS & Cloud Technology,"B2B, SMB, SaaS",N/A,N/A,Verified
orleans-metropole,ORLEANS METROPOLE,https://www.orleans-metropole.fr/,https://www.linkedin.com/company/orleans-metropole/,"ORLEANS METROPOLE it focuses on ecological transition, proximity, and regional influence.",SaaS & Cloud Technology,"B2B, B2C",N/A,N/A,Verified
moonlite-labs,Moonlite Labs,https://www.moonlitelabs.com/,https://www.linkedin.com/company/moonlite-media-inc,"Please confirm if you are referring to the content creation platform ""Moonlite Labs"" found at com/ or another company with the same or similar name.",SaaS & Cloud Technology,B2B,Natalie Rebot,Founder,Verified
tailoor,TAILOOR,https://tinkertailor.tech/,https://www.linkedin.com/company/tailor,TAILOOR tinker Tailor is a company focused on wearable technology and hobby electronics.,Data Science & Analytics,B2C,Misato Takahashi,Founder,Verified
papilio-bio,Papilio Bio,https://www.euroquity.com/en/company/papiliobio,https://linkedin.com/company/papilio-bio,Papilio Bio develops an HPV screening self-test designed for both men and women to make HPV screening easy and accessible.,HealthTech & Biotech,"B2B, B2C, SMB",Uday Patel,CEO,Verified
systerion-sp-z-oo,Systerion Sp. z o.o.,https://systerion.com/,https://www.linkedin.com/company/systerion-sp-z-o-o,"Systerion leverages nanotechnology, industrial experience, and systems engineering to deliver precise solutions for R&D and advanced manufacturing.",SaaS & Cloud Technology,B2B,N/A,N/A,Verified
preta-porter-cosmetics,Preta Porter Cosmetics,https://www.bobbibrowncosmetics.com/,https://www.linkedin.com/company/pret-a-porter-inc,"I couldn't find specific information about ""Preta Porter Cosmetics.",AI & Machine Learning,B2B,N/A,N/A,Verified
