Slug,Company Name,Official Website,LinkedIn Profile,Company Description,Industry,Target Customers,CEO/Founder Name,CEO/Founder Title,Data Quality
cyprusministry-of-energy-commerce-and-industry,Cyprus,https://www.cleanenergywire.org/experts/ministry-energy-commerce-and-industry-cyprus,https://www.linkedin.com/company/the-cyprus-institute,"Cyprus-Ministry of Energy, Commerce and Industry the Ministry of Energy, Commerce and Industry of Cyprus is responsible for planning and implementing policies in energy, trade, industry, technology...",CleanTech & Energy,"B2B, B2C",Nikos Christodoulides,President,Verified
dshape-limited,D,https://d-shape.com/,https://www.linkedin.com/company/d/,"D-Shape is a pioneering 3D construction printing company that uses advanced particle bed 3D printing technology to create large-scale, intricate structures.",CleanTech & Energy,B2B,N/A,N/A,Verified
dun-seul-geste,D’un Seul Geste,https://dunseulgeste.fr/,https://linkedin.com/company/d-un-seul-geste,D’un Seul Geste designs immersive and gamified first aid and fire safety training using virtual reality (VR).,Gaming & Media,B2B,Emmanuel Bourcet,CEO,Verified
dabchy,Dabchy,https://www.dabchy.com/,https://www.linkedin.com/company/dabchy,Dabchy Egypt) and Dabchy is a localized fashion marketplace where primarily women can buy and sell new or used clothing and fashion items online.,Fashion & Retail,B2C,Ameni Mansouri,Cofounder,Verified
dadycar,DadyCar,https://dadycar.com/,https://www.linkedin.com/company/dadycar/,Dadycar offers an AI-powered SaaS fleet management software solution designed to optimize automotive fleet management for businesses in Europe.,SaaS & Cloud Technology,"B2B, SaaS",N/A,N/A,Verified
dahua-technology-france,Dahua Technology France,https://france.dahuatech.com/,https://linkedin.com/company/dahua-technology-france,"Dahua Technology France is a subsidiary of Dahua Technology, a global leader in intelligent IoT solutions and services, specializing in video surveillance technology.",SaaS & Cloud Technology,"B2B, Enterprise",N/A,N/A,Verified
dalia,Dalia,https://www.dalia.co/,https://www.linkedin.com/company/daliainc,Dalia is a candidate conversion platform that helps employers convert more best-fit candidates from existing sources and platforms by providing personalized job seeker experiences with zero work fr...,SaaS & Cloud Technology,"B2B, Enterprise",Sam Fitzroy,Founder,Verified
damo-srl,DAMO Srl,https://damosrl.com/,https://www.linkedin.com/company/damo-srl,"Damo Srl, based in Bassano del Grappa, started as a design studio and evolved into a production company in the industrial automation sector.",SaaS & Cloud Technology,B2B,N/A,N/A,Verified
dancr,DANC.R,https://daniostore.com/,https://linkedin.com/company/dancr-app,"DANC.R no verified information about ""DANC. Please provide additional details like industry or location for more accurate search results.",AI & Machine Learning,B2B,N/A,N/A,Verified
danstruct-coltd,"Danstruct Co.,Ltd.",https://www.danstruct.co/,https://www.linkedin.com/company/danstruct18,"Danstruct Co.,Ltd. d) Korean-pop choreography content production and distribution solutions.",Gaming & Media,B2B,N/A,N/A,Verified
daspren,Daspren,https://daspren.com/,https://www.linkedin.com/company/daspren/?originalSubdomain=fr,Daspren what does this company do.,AI & Machine Learning,"Enterprise, SMB",N/A,N/A,Verified
data-new-road,DATA NEW ROAD,https://www.data-newroad.com/,https://www.linkedin.com/company/data-new-road,"Data New Road develops and commercializes decision support tools for the management, use, and operation of road and highway infrastructures or mobility-related services based on big data analysis.",SaaS & Cloud Technology,B2B,N/A,N/A,Verified
data-studio-risques-dsr,Data Studio Risques (DSR),https://www.seo-sea-expertise.com/google-data-studio-opportunites-et-risques/,https://www.linkedin.com/company/dsr-data,"I do not have additional details about ""Data Studio Risques (DSR)"" at this time.",Data Science & Analytics,B2B,N/A,N/A,Verified
datagalaxy,DataGalaxy,https://www.datagalaxy.com/,https://www.linkedin.com/company/datagalaxy,"DataGalaxy is a data and AI product governance platform that connects strategy, product management, discovery, and business impact in one seamless experience.",CleanTech & Energy,"B2B, Enterprise",N/A,N/A,Verified
datagreen,DATAGREEN,https://www.mwcbarcelona.com/exhibitors/32393-datagreen,https://www.linkedin.com/company/data-green,DataGreen detailed information: 1.,CleanTech & Energy,B2B,Karim Abed Abbas,CEO,Verified
datagustoinc,"datagusto,inc.",https://datagusto.ai/,https://linkedin.com/company/datagusto,Datagusto provides a governance platform for AI agents that prevents AI agent failures through root cause analysis and adaptive guardrails.,AI & Machine Learning,"B2B, Enterprise",Mao Parr,CEO,Verified
dataiku,Dataiku,https://www.dataiku.com/,https://www.linkedin.com/company/dataiku,"Dataiku is an artificial intelligence (AI) and machine learning company that provides a universal AI platform to build, deploy, and manage data, analytics, and AI projects.",AI & Machine Learning,"B2B, Enterprise",Florian Douetteau,Cofounder,Verified
datalab-anfsi,Datalab,https://www.police-nationale.interieur.gouv.fr/,https://www.linkedin.com/company/datalab,"The official information about ANFSI can be found on the French Ministry of the Interior website and related official pages, but there is no separate dedicated website for Datalab - ANFSI.",SaaS & Cloud Technology,B2B,Andrej Mertelj,CEO,Verified
datalliance,Datalliance,https://www.datalliance.com/,https://www.linkedin.com/company/datalliance,Datalliance is the world's largest Vendor Managed Inventory (VMI) service provider.,SaaS & Cloud Technology,"B2B, Enterprise, SaaS",Mike Cornell,CEO,Verified
dataofficer,DataOfficer,https://dataofficer.com/,https://www.linkedin.com/company/data-protection-officer,"There is no active company named ""DataOfficer"" with a verified official website, as the domain ""DataOfficer.",Data Science & Analytics,B2B,N/A,N/A,Verified
datascientistfr,DataScientist.fr,https://datascientist.fr/,N/A,DataScientist.fr dataScientist.,AI & Machine Learning,"B2B, B2C",N/A,N/A,Verified
datastone,Datastone,https://datastoneglobal.com/,https://linkedin.com/company/datastone-solutions,"Datastone Solutions is an Information Technology company specializing in software development, website and web application development, and mobile application solutions.",SaaS & Cloud Technology,B2B,N/A,N/A,Verified
dative,DATIVE,,https://www.linkedin.com/company/dative-ai/,DATIVE is a technology company.,Technology,B2B,N/A,N/A,Verified
datopia,Datopia,https://www.datopia.co.uk/,https://www.linkedin.com/company/datopia,"Datopia provides innovative app development, web solutions, automation, and digital growth services.",Data Science & Analytics,"B2B, SMB",N/A,N/A,Verified
datus,DATUS,https://datus.io/,https://www.linkedin.com/company/datus-io,DATUS .,SaaS & Cloud Technology,"B2B, Enterprise, SMB",N/A,N/A,Verified
daven,Daven,,https://www.linkedin.com/company/daven-partners-consulting,Daven is a technology company.,Technology,B2B,Daven Michaels,Founder,Verified
davi,DAVI,,https://www.linkedin.com/company/davi-inc,DAVI is a technology company.,Technology,B2B,Pascal Arbault,Founder,Verified
dayone-healthtech-innovation,DayOne HealthTech Innovation,https://theorg.com/org/dayone-healthtech-innovation,https://www.linkedin.com/company/dayone-healthcare-innovation/,"DayOne is a healthcare innovation platform and accelerator based in Basel, Switzerland.",HealthTech & Biotech,"B2B, SMB",N/A,N/A,Verified
dbs-group,DBS GROUP,https://www.dbs.com/,https://www.linkedin.com/company/dbs-bank,"What does the company do. DBS Group Holdings Ltd is a leading financial services group in Asia providing retail, small and medium-sized enterprise (SME), corporate, and investment banking services.",FinTech,"B2B, B2C, Enterprise",Tan Su Shan,Chief Executive Officer,Verified
dehub-initiative,de:hub Initiative,https://www.de-hub.de/,https://www.linkedin.com/company/dehubinitiative/,The de:hub Initiative (Digital Hub Initiative) is a network of 25 digital hubs across Germany that connects medium-sized businesses (Mittelstand) and large corporations with innovation partners fro...,SaaS & Cloud Technology,"B2B, Enterprise, SMB",N/A,N/A,Verified
dealinka,DEALINKA,https://dealinka.fr/,https://linkedin.com/company/dealinka,Dealinka is a company focused on revalorizing dormant stocks and unsold products in an eco-responsible way.,SaaS & Cloud Technology,B2B,N/A,N/A,Verified
dealt,DEALT,http://www.dealt.com/,https://linkedin.com/company/getdealt,"Dealt is a pure marketplace where Borrowers, Brokers, and Lenders can efficiently communicate and transact commercial real estate credit.",FinTech,B2B,N/A,N/A,Verified
debecom,Debecom,https://www.debecom.de/,https://www.linkedin.com/company/debecom/,"What does the company do. Debecom GmbH is an electrotechnical planning office specializing in consulting, planning, tendering, and project supervision.",SaaS & Cloud Technology,"B2B, B2C",N/A,N/A,Verified
decisimo,Decisimo,https://www.decisimo.com/,https://www.linkedin.com/company/decisimo,Decisimo is a cloud-based decision intelligence platform that automates the execution of business rules using rule-based and machine learning-driven decisioning.,SaaS & Cloud Technology,B2B,Martin Ciklamini,Founder,Verified
deel,Deel,https://deel.com/,https://www.linkedin.com/company/deel,"Deel simplifies global team management with tools for hiring, onboarding, and compliance.",SaaS & Cloud Technology,B2B,Alex Bouaziz,Cofounder,Verified
deemea,Deemea,https://deemea.com/,N/A,Deemea is a digital health company specializing in an AI-driven platform that empowers clinical research teams to efficiently manage and interpret medical imaging data.,HealthTech & Biotech,B2B,Charlotte Pouchy,CEO,Verified
deep-iotech,Deep IoTech,https://www.deepiotech.com/,N/A,"I was unable to find specific details about Deep IoTech's key people, headquarters, and founding date.",Data Science & Analytics,B2B,N/A,N/A,Verified
deephawk,DeepHawk,https://deephawk.ai/,https://www.linkedin.com/company/deephawk,DeepHawk is a next-generation AI company specializing in visual quality control for manufacturers.,AI & Machine Learning,B2B,Gilles Allain,CEO,Verified
deepixel,DEEPIXEL,https://www.de/,https://www.linkedin.com/company/deepixel/,DEEPIXEL .,AI & Machine Learning,"B2B, SMB",N/A,N/A,Verified
deeplayer-ai,DEEPLAYER AI,https://www.deeplayer.ai/,https://www.linkedin.com/company/deeplayer,"Deeplayer AI develops intelligent AI agents using breakthrough AI technologies, primarily focused on the tourism, culture, and media sectors.",AI & Machine Learning,"B2B, Enterprise",Anis Ayari,President,Verified
deeplife,Deeplife,https://www.deeplife.co/,https://www.linkedin.com/company/deeplifeco,DeepLife is a biotech company that harnesses deep learning on multi-omics data to model cells and efficiently engineer their behavior.,HealthTech & Biotech,B2B,N/A,N/A,Verified
deepphy,DeepPhy,https://deepphy.com/,https://linkedin.com/company/deepphy,"DeepPhy is a startup offering AI solutions for engineering sciences, leveraging Physics-Informed Machine Learning (PIML) technology.",AI & Machine Learning,"B2B, Enterprise, SMB",Yoann Cheny,CEO,Verified
deepset,deepset,https://www.deepset.ai/,https://www.linkedin.com/company/deepset-ai,deepset nLP) systems.,SaaS & Cloud Technology,"B2B, Enterprise",Milos Rusic,Cofounder,Verified
deepwave,DeepWave,https://deepwavedigital.com/,https://www.linkedin.com/company/dwavetw/,"There are multiple companies named ""DeepWave"" with distinct profiles.",SaaS & Cloud Technology,"B2B, B2C, Enterprise, SaaS",John Ferguson,CEO,Verified
deesup-srl,Deesup Srl,https://www.deesup.com/,https://linkedin.com/company/deesup,"What does this company do. Deesup is the first Italian curated online marketplace for buying and selling authentic second-hand and ex-display high-end design furniture, lighting, and accessories.",Fashion & Retail,"B2B, B2C",N/A,N/A,Verified
dejablue,DejaBlue,https://www.de/,https://www.linkedin.com/company/deja-blue-energy,"DejaBlue provides turn-key electric vehicle (EV) charging solutions tailored for businesses, universities, hotels, and fleets.",CleanTech & Energy,B2B,N/A,N/A,Verified
deki,Deki,https://www.dekielectronics.com/,https://www.linkedin.com/company/deki,Deki Electronics is India's largest manufacturer of film capacitors.,SaaS & Cloud Technology,"B2B, B2C",Vashti Seth,Founder,Verified
dlgation-gnrale-lentreprenariat-rapide-des-femmes-,Délégation générale à l’Entreprenariat Rapide des Femmes et des Jeunes,https://www.de/,https://linkedin.com/company/dersenegal,The Délégation générale à l’Entreprenariat Rapide des Femmes et des Jeunes (DER/FJ) is a structure created by decree in 2017 to promote and support entrepreneurship among women and youth in Senegal.,FinTech,"B2B, B2C",N/A,N/A,Verified
delibia,DELIBIA,https://kids-angel.com/,https://linkedin.com/company/delibia,Deliba is a family-owned agricultural company producing extra virgin olive oil and various traditional products.,FoodTech,"B2B, B2C",N/A,N/A,Verified
dmarchessimplifies,Démarches,https://www.demarches-simplifiees.fr/,https://www.linkedin.com/company/demarche-francaise,Démarches-Simplifiées démarches Simplifiées is an online application that allows public service organizations to create administrative procedures quickly and manage user requests on a dedicated pla...,SaaS & Cloud Technology,B2C,N/A,N/A,Verified
demetair,Demet'air,https://www.demet-air.fr/,https://linkedin.com/company/demet-air,What does this company do. Demet'Air is a French start-up specializing in innovative and accessible vegetation solutions for green roofs and walls.,CleanTech & Energy,"B2B, B2C",N/A,N/A,Verified
denkweit-gmbh,DENKweit GmbH,https://denkweit.com/,https://linkedin.com/company/denkweit,DENKweit GmbH specializes in AI-based image analysis and magnetic field imaging.,SaaS & Cloud Technology,B2B,N/A,N/A,Verified
department-of-culture-and-tourism-abu-dhabi-dct-ab,Department of Culture and Tourism – Abu Dhabi (DCT Abu Dhabi),https://rocketreach.co/department-of-culture-and-tourism-abu-dhabi-dct-abu-dhabi-profile_b5c9537bf42e374e,https://www.linkedin.com/company/dctabudhabi/life,"The Department of Culture and Tourism – Abu Dhabi (DCT Abu Dhabi) is a government agency responsible for regulating, promoting, and developing domestic and international tourism as well as culture ...",Gaming & Media,"B2B, B2C",N/A,N/A,Verified
deplano,DePlano,https://www.e-borghi.com/,https://linkedin.com/company/deplano,"I currently have no additional details about the company ""DePlano.",AI & Machine Learning,B2B,N/A,N/A,Verified
deplano-b2b,DePlano (B2B),https://www.datacaptive.com/,https://linkedin.com/company/deplano,"I have not found specific information about ""DePlano (B2B)"" so far.",SaaS & Cloud Technology,B2B,N/A,N/A,Verified
depositphotos-eu,Depositphotos EU,https://depositphotos.com/,https://www.linkedin.com/company/depositphotos,"Depositphotos is a leading content marketplace offering a vast library of over 200 million royalty-free stock photos, vector images, videos, and music files.",SaaS & Cloud Technology,"B2B, B2C, Enterprise",N/A,N/A,Verified
desk,DESK,https://smartydesk.com/,https://www.linkedin.com/company/desk,"I currently do not have more specific details about the company ""DESK.",AI & Machine Learning,B2B,Jason McCann,CEO,Verified
detera-therapeutics,Detera Therapeutics,https://www.detera-therapeutics.com/,https://www.linkedin.com/company/detera?trk=similar-pages_result-card_full-click,DETERA Therapeutics is a preclinical stage biopharmaceutical company focused on developing transformative therapies for rare kidney diseases.,HealthTech & Biotech,B2B,N/A,N/A,Verified
detesia,Detesia,https://detesia.com/,https://www.linkedin.com/company/detesia/,"For the most precise and updated information on Detesia's key people, exact headquarters location, and founding year, please refer directly to their official website.",AI & Machine Learning,B2B,Tim Walita,CEO,Verified
detta-co-sas,Detta & Co SAS,https://www.flysas.com/,N/A,"Without additional details like industry or location, it is challenging to find verified information about ""Detta & Co SAS.",Data Science & Analytics,B2B,N/A,N/A,Verified
deutschfranzsische-hochschule-universit-francoalle,Deutsch-Französische Hochschule / Université franco-allemande (DFH,https://www.dfh-ufa.org/,N/A,The Deutsch-Französische Hochschule / Université franco-allemande (DFH-UFA) is a network of 210 affiliated universities from France and Germany offering 194 integrated bi-national and tri-national ...,Gaming & Media,"B2B, B2C",N/A,N/A,Verified
deutsches-forschungszentrum-fr-knstliche-intellige,Deutsches Forschungszentrum für Künstliche Intelligenz DFKI,https://www.dfki.de/,https://linkedin.com/company/dfki,"It develops AI solutions for healthcare, autonomous robots for extreme environments, and applications promoting efficiency in agriculture, manufacturing, and energy.",AI & Machine Learning,"B2B, Enterprise",N/A,N/A,Verified
dev4side,Dev4side,https://www.dev4side.com/,https://www.linkedin.com/company/dev4side,Dev4Side is a software consulting and development company specializing in customized software solutions across the Microsoft ecosystem.,SaaS & Cloud Technology,B2B,Dheeraj Pandey,Cofounder,Verified
devana,DEVANA,,N/A,DEVANA is a technology company.,Technology,B2B,Barry Lake,Founder,Verified
devforma,DEVFORMA,https://devforma.com/,https://www.linkedin.com/company/devforma,"DEVFORMA is an organization that offers professional training in cutting-edge IT technologies including cybersecurity, development and programming, and web marketing.",AI & Machine Learning,B2B,Rahul Subramaniam,Founder,Verified
devpoint,DevPoint,https://www.devpoint.com/,https://linkedin.com/company/groupe-devpoint,"Please specify which DevPoint company you want detailed information about: - DevPoint (software consultancy and product design) at com/ - DevPoint Labs (coding bootcamp) based in Salt Lake City, Ut...",SaaS & Cloud Technology,B2B,Nhi Doan,Cofounder,Verified
dfi,DFI,https://www.dfibeds.com/,https://www.linkedin.com/company/dfi-inc,"DFI Beds is Ireland’s largest online bedding retailer offering a wide range of high-quality bedding products including mattresses, divan beds, and headboards.",SaaS & Cloud Technology,B2C,N/A,N/A,Verified
dgse,DGSE,https://www.dgse.com/,https://www.linkedin.com/company/dgse,"DGSE (DGSE Companies, Inc.",Fashion & Retail,"B2B, B2C",N/A,N/A,Verified
dicare,Di&Care,https://di-care.com/,https://linkedin.com/company/di-care,Di&Care is a French company dedicated to the development and commercialization of digital therapeutics in the field of sleep and mental health.,HealthTech & Biotech,"B2B, B2C",N/A,N/A,Verified
diagen-ai-inc,DiaGen Ai. Inc,https://diagen.ai/,https://www.linkedin.com/company/diagen-ai,DiaGen AI Inc.,HealthTech & Biotech,B2B,Paolo Lobo,President,Verified
diagrams-technologies,DIAGRAMS TECHNOLOGIES,https://diagrams-technologies.com/,https://www.linkedin.com/company/diagrams-technologies/,DIAGRAMS Technologies specializes in industrial data science and develops software dedicated to predictive maintenance.,SaaS & Cloud Technology,B2B,N/A,N/A,Verified
dialecta-ltd,Dialecta Ltd.,https://www.dialecticanet.com/,https://www.linkedin.com/company/dialecta,Dialectica is an information services firm that provides real-time insights and expert knowledge to business professionals.,Data Science & Analytics,B2B,George Tsarouchas,Founder,Verified
dicteai-by-livdeo,Dicte.ai by Livdeo,https://www.dicte.ai/,https://www.linkedin.com/company/livdeo-sas,"Dicte.ai by Livdeo aI-powered transcription with speaker identification, meeting minutes generation, SWOT analysis, mind maps, and detailed report creation.",AI & Machine Learning,"B2B, Enterprise",N/A,N/A,Verified
didask,Didask,https://www.didask.com/,https://www.linkedin.com/company/didask,What does this company do. Didask is a next-generation LMS (Learning Management System) platform that integrates the first educational AI based on cognitive sciences to create and deliver effective...,SaaS & Cloud Technology,B2B,Son Ly,CEO,Verified
dieng-innovation,Dieng Innovation,,N/A,"Dieng Innovation however, the company is registered and listed on French business directories such as Pappers:.",SaaS & Cloud Technology,B2B,N/A,N/A,Verified
dify,Dify,https://dify.ai/,https://www.linkedin.com/company/langgenius,Dify is an open-source large language model (LLM) application development platform that integrates Backend-as-a-Service and LLMOps concepts.,SaaS & Cloud Technology,"B2B, Enterprise",Luyu Zhang,Cofounder,Verified
digihealth-services-solutions,DigiHealth Services & Solutions,https://www.digihealthservices.org/home,N/A,"I found limited specific information about ""DigiHealth Services & Solutions.",HealthTech & Biotech,B2B,Hiren Popat,President,Verified
digihub-dsseldorf,digihub Düsseldorf,https://www.digihub.de/,https://linkedin.com/company/digital-innovation-hub-d%C3%BCsseldorf-rheinland-gmbh,What does this company do. digihub Düsseldorf is an expert in accelerating digital startup ideas with growth potential.,CleanTech & Energy,"B2B, SMB",N/A,N/A,Verified
digiotouch-ou,Digiotouch OU,https://www.digiotouch.com/,https://linkedin.com/company/digiotouch-ou,"Digiotouch delivers secure, sustainable digital transformation across industries by digitizing legacy processes, operations, and assets.",SaaS & Cloud Technology,B2B,Soumya Kanti Datta,Founder,Verified
digiskin,DigiSkin,https://www.gematsu.com/2017/08/tokyo-clanpool-digiskins-trailer,https://linkedin.com/company/digi-skin,DigiSkin .,HealthTech & Biotech,B2C,N/A,N/A,Verified
digital-africa,Digital Africa,https://www.digital-africa.co/,https://linkedin.com/company/digitalafrica,"Digital Africa, a subsidiary of Proparco (AFD Group), supports tech startups in Africa by investing directly in innovative startups, especially in ecosystems underserved by traditional investors.",SaaS & Cloud Technology,"B2B, SMB",N/A,N/A,Verified
digital-and-human,Digital and Human,http://www.digitalandhuman.fr/,https://linkedin.com/company/digital-and-human,"Digital and Human specializes in training that combines the power of virtual reality with expert trainers focusing on soft skills such as public speaking, management, personal development, and more.",Gaming & Media,B2B,N/A,N/A,Verified
digital-earth-pacific,Digital Earth Pacific,https://digitalearthpacific.org/,https://www.linkedin.com/company/digital-earth-pacific,Digital Earth Pacific (DEP) is an operational earth observation system that uses decades of satellite data to monitor and show how local environments in the Pacific region are changing over time.,SaaS & Cloud Technology,B2B,N/A,N/A,Verified
digital-smart-trash,Digital Smart Trash,https://www.digitaltrends.com/cool-tech/smart-bin-e-trash-can/,https://www.linkedin.com/company/smart-trash,Digital Smart Trash appears to be a less prominent company with limited publicly available details.,AI & Machine Learning,B2B,N/A,N/A,Verified
dijon-bourgogne-invest,Dijon Bourgogne Invest,https://www.dijonbourgogneinvest.fr/,https://linkedin.com/company/dijonbourgogneinvest,Dijon Bourgogne Invest is the economic development and attractiveness agency for Dijon Métropole.,AI & Machine Learning,"B2B, Enterprise",N/A,N/A,Verified
dimarc,DIMARC,https://www.dimarcogroup.com/,https://www.linkedin.com/company/dimarc/,DiMarco Group is a full-service development company that applies cutting-edge design and building concepts to meet 21st-century real estate needs.,SaaS & Cloud Technology,B2B,N/A,N/A,Verified
directh2,DirectH2,https://www.directh2.com/,https://www.linkedin.com/company/directh2,"DirectH2, Inc. is a technology company developing modular hydrogen production solutions.",CleanTech & Energy,"B2B, Enterprise",Aditya Mohite,Cofounder,Verified
direction-gnrale-des-entreprises,Direction générale des Entreprises,https://www.entreprises.gouv.fr/,https://linkedin.com/company/dgentreprises,The Direction générale des Entreprises (DGE) is a French government directorate under the Ministry of Economy and Finance.,SaaS & Cloud Technology,"B2B, Enterprise",N/A,N/A,Verified
direction-interministrielle-du-numrique-dinum,Direction interministérielle du Numérique (DINUM),https://www.data.gouv.fr/,https://linkedin.com/company/direction-interministerielle-du-numerique-dinum,Direction interministérielle du Numérique (DINUM) .,SaaS & Cloud Technology,B2B,N/A,N/A,Verified
disaitek,DISAITEK,https://www.disaitek.ai/,https://www.linkedin.com/company/disaitek,What does this company do. Disaitek leverages spatial technologies and advanced artificial intelligence algorithms to tackle environmental issues.,AI & Machine Learning,"B2B, Enterprise",Anthony Graveline,President,Verified
dishup-srl,Dishup srl,https://www.dishup.co.uk/contact,https://linkedin.com/company/dishup-it,Dishup is a cloud-based AI platform for restaurant management that handles every aspect of culinary business operations in one powerful solution.,SaaS & Cloud Technology,B2B,N/A,N/A,Verified
dive-in-group,DIVE IN GROUP,https://dive-group.com/,https://www.linkedin.com/company/dive-group-mystery-shopping,Dive Group is a customer service development and evaluation company specializing in mystery shopping.,Data Science & Analytics,B2B,N/A,N/A,Verified
diversidays,Diversidays,https://diversidays.com/,https://www.linkedin.com/company/diversidays,Diversidays what does this company do.,FinTech,"B2B, B2C",Anthony Babkine,CEO,Verified
divrsitee,Divrsitee,https://www.diversityofficial.com/,N/A,"No verified information found for ""Divrsitee. "" Please provide alternative spellings or more details for further search, or specify another company for information.",Gaming & Media,B2B,N/A,N/A,Verified
